Whataburger Fancy Ketchup 40oz,54276187,851953005181,,,,4.48,1.08,0.32,27.1,109,109,0.3,14,0.39,14,26,265,928,0.16,,1.46,,,4.1,,1.43,3,0,12.5,21.5,,0.014,0.158,0,
"Whataburger Spicy Ketchup, 20 oz Squeeze Bottle",51762276,851953005013,17,g,20 ONZ,2.86,0,0,29.4,118,118,0,0,0,,,294,941,,0,,,,0,,,,,,23.5,0,0,,,
"Great Value Tomato Ketchup, 32 oz",406608510,78742008066,17,g,32 oz,2.38,0,0,29.4,118,118,0,0,0,,,0,1060,,,,,,,,,,,,23.5,0,0,,,23.5
"Hunt's All Natural Tomato Ketchup Bottle, 32 oz",345017175,27000002650,17,g,38.5 ONZ,3.24,0,0,29.4,118,118,0,0,0,,,294,941,,0,,,,0,,,,,,23.5,0,0,,,
"G Hughes Sugar Free Ketchup, 13 oz Bottle",540060996,26825000193,16,g,,3.62,10.3,31,50.5,523,523,3.4,0,2.48,49,132,202,448,1.05,,3.51,,,0,,5.54,34.8,48,38.5,0,,8.62,0.112,0,
"Whataburger Fancy Ketchup, 20 oz Squeeze Bottle",51762275,851953005006,17,g,20 ONZ,2.86,0,0,29.4,118,118,0,0,0,,,294,941,,0,,,,0,,,,,,23.5,0,0,,,
"Great Value Spicy Tomato Ketchup, 20 oz",318904523,78742232348,17,g,20 oz,1.98,0,0,29.4,118,118,0,0,0,,,0,1060,,,,,,,,,,,,23.5,0,0,,,23.5
"Great Value Tomato Paste, 6 oz",10415519,78742369556,33,g,6 ONZ,0.86,3.03,0,21.2,106,106,6.1,0,3.03,,,939,76,,,,0,,3.6,,,,,,12.1,0,0,,,
"Heinz Organic Tomato Ketchup, 14 oz Bottle",35486044,13000008990,17,g,32 oz,3.98,0,0,29.4,118,118,0,0,0,,,0,1060,,,,,,,,,,,,23.5,0,0,,,23.5
Primal Kitchen A Tad Sweet Squeeze Ketchup - Sweetened with Honey 18.5oz,2024550118,840224600385,16,g,524 g,7.79,0,0,12.5,62,62,,,,,,,1000,,,,,,,,,,,,12.5,,,,,6.2
"Hunt's Tomato Sauce, 8 oz Can",10295084,27000390054,62,g,8 ONZ,0.67,1.61,0,6.45,32,32,3.2,0,0,,,290,613,,0,,0,,3.9,,,,,,3.23,0,0,,,
Arby's Original Sauce 16oz Bottle,1653883851,70200841840,,,,3.98,15.2,10.3,22.2,,,1.3,55,2.64,23,200,224,653,2.27,,,,,,,4.34,,,40.1,3.84,0.389,3.4,0.215,0.96,
"Rao's Homemade Tomato Sauce | Tomato Basil | 32 oz | Versatile Pasta Sauce | Carb Conscious, Keto Friendly | All Natural | Premium Quality | Made with Slow-Simmered Italian Tomatoes & Basil",358735209,747479001151,125,g,24 oz,8.52,0.8,2.8,5.6,48,48,1.6,32,0.8,,,264,288,,,,,,,,,,,,4,0,0,,,0
"Horizon Organic Half & Half, 1 Quart",22875650,742365232954,30,ml,1 qt,4.74,3.33,10,3.33,133,133,0,167,0,,,0,50,,,,,,,,,,,,3.33,0,6.67,,,0
"Marketside Organic Grass-Fed Ground Beef, 93% Lean/ 7% Fat, 1 lb, 3 Count",1120348,681131288514,112,g,,19.47,,,,,,,,,,,,,,,,,,,,,,,,,,,,,
"Great Value, Quick Cook Steel Cut Oats, Organic, 24 oz",54300726,78742135779,40,g,680 g,3.72,12.5,6.25,67.5,375,375,10,50,4.38,,,375,0,,,,,,,,,,,,0,0,1,,,
"Fast Fixin' Restaurant Style Homestyle Chicken Breasts with Gravy Mix, 1 lb 6.75 oz (Frozen)",17619848,75901331003,,,22.75 oz,8.98,14.3,12.5,15.2,232,232,0.9,18,1.29,,,,509,,,,,,,,,,,,0.89,0,1.34,,,
Amy's Kitchen Non GMO Vegetable Lasagna 9.5 oz Box (Frozen),10789412,42272000326,269,g,,5.68,6.87,6.04,14.2,139,139,1.9,150,0.55,21,140,170,445,0.87,647,0.46,0,,1.1,,0.81,17.8,1,12.3,2.54,,2.87,0.102,0.59,
"Equate High Performance Protein Nutrition Shake, Caramel, 11 fl oz, 12 Ct",540704415,681131249454,325,ml,44 FL OZ/1.3 L,20.98,9.23,1.08,1.54,52,52,0.3,200,1.38,31,154,95,68,1.15,385,,62,,4.6,,1.54,6.2,18,,0.31,0,0.31,0.154,0.46,
"Great Value Shredded Low-Moisture Part-Skim Mozzarella Cheese, 80 oz",39171185,78742049809,28,g,,17.68,23.6,19.7,8.06,304,304,0,716,0.23,29,537,131,682,3.61,846,0.49,14,,0,,0.151,1.3,0,14.2,2.24,0.709,11.5,0.111,1.33,
"Talenti Gelato Layers Salted Caramel Truffle 11.6oz, 323.1 g",914207327,186852001096,117,g,323.1 g/11.4 oz,4.93,4.27,12.8,35.9,274,274,0.9,85,0.62,,,179,120,,,,14,,,,,,,,29.1,0,8.55,,,22.2
"TGI Fridays Loaded Cheddar & Bacon Potato Skins Value Size Frozen Snacks & Appetizers, 22.3 oz Box Giant",20897704,46704096406,81,g,6 oz/170.4 g,12.24,10.6,24.6,52.8,493,493,7,70,1.27,,,,1270,,352,,,,0,,,,,,0,0,3.52,,,
"Marie Callender's Pastry Pie Shells, 16 oz, 2 Ct (Frozen)",10810980,612781201004,28,g,16 ONZ,3.62,7.14,28.6,46.4,464,464,0,0,4.29,,,0,179,,0,,0,,0,,,,,,3.57,0,12.5,,,
"Great Value Classic Dipped Ice Cream Cones Variety Pack, 4.6 fl oz, 8 Count",154587710,78742152370,,,4.4 fl oz,5.36,5.32,17,36.2,309,309,1.1,96,0.74,,,223,112,,,,,,,,,,,,23.4,0,10.6,,,19.1
"So Delicious Dairy Free Dipped Salted Caramel Cashew Milk Frozen Dessert Bar, 4 Count",167130047,744473000302,58,g,15 fl oz/440 mL,5.47,3.8,2.53,27.8,114,114,7.6,25,0,,,,253,,0,,,,0,,,,,,6.33,0,1.27,,,
"Great Value Cheese Burger Sandwiches, 4 Count (Frozen)",591310760,78742248530,148,g,,8.67,3.9,6.25,34.4,204,204,0.8,83,1.35,21,100,170,192,0.48,,0.25,,,0.5,,0.767,0.8,10,20.9,24.3,,2.8,0.043,0.08,
"Marie Callender's Coconut Cream Pie, 30.3 oz (Frozen)",120517467,612781101083,107,g,38 ONZ,5.97,3.36,16,34.4,294,294,0.8,50,1.51,,,101,160,,0,,,,0,,,,,,17.6,0,10.9,,,
"Horizon Organic Heavy Whipping Cream, 1 Pint",53986354,742365216855,15,ml,1 pt,5.24,3.33,10,3.33,133,133,,167,,,,,50,,,,,,,,,,,,3.33,,6.67,,,
"Hot Pockets Frozen Snacks Crispy Buttery Crust Steak and Cheddar Sandwiches, 22.5 oz, 5 Count Box  (Frozen)",40839821,43695237658,127,g,,6.97,8.9,8.6,30.4,,,1.1,152,2.97,18,168,188,346,0.95,265,0.29,10,,4.9,,3.42,0.8,43,29.1,7.6,,2.62,0.095,0.35,
"COLUMBUS, Salami Trio, Sliced Charcuterie Meat, 12oz Variety Plastic Pack",174707224,73007106037,,,12 oz,9.98,21.4,21.4,7.14,321,321,0,71,1.29,,,,1640,,357,,,,8.6,,,,,,3.57,0,7.14,,,
"Great Value Finely Shredded Sharp Cheddar Cheese, 80 oz",130124754,78742148687,28,g,16 oz/1 lbs/453 g,17.68,21.4,32.1,7.14,393,393,0,689,0,,,71,643,,,,29,,,,,,,,0,0,17.9,,,
"Fleischmann's Classic Bread Machine Yeast, 4 oz",10306744,40100017874,nan,nan,4 oz/113 g,5.48,0,0,0,0,0,,,,,,,0,,,,,,,,,,,,,,,,,
"Sugar in the Raw Turbinado Cane Sugar, 32 oz",10292113,44800001423,,,24 oz/680 g,4.14,0,0,100,375,375,0,12,0,,,0,0,,,,0,,,,,,,,100,0,0,,,
Bomb Pop Banana Fudge Bar,50893890,70640013395,131,g,21 fl oz/621 mL,3.52,3.82,1.53,27.5,137,137,0,168,0.53,,,260,73,,,,0,,,,,,,,20.6,0,1.15,,,13.7
"Traditional Medicinals Tea, Organic Throat Coat Lemon Echinacea, Tea Bags, 16 Count",28644913,32917001597,,,,4.92,0,0,0,0,0,0,,,,,,0,,,,,,,,,,,,0,0,0,,,0
"Great Value Organic Ground Cinnamon, 1.5 oz",51258933,78742131740,,,,4.36,5.71,14.3,51.4,357,357,1.4,286,5.14,,286,50,557,,1430,,,,0,,5.71,,,,15.7,0,1.43,0.571,1.71,
CLIF Kid Zbar - Iced Oatmeal Cookie - Soft Baked Whole Grain Snack Bars - 1.27 oz. (6 Pack),26958310,722252194305,36,g,,5.32,5.55,9.72,74.7,416,416,8.3,444,2.7,82,244,333,375,1.15,,0.98,,,39.1,,0.478,8.7,16,22.5,30.6,,2.72,0.073,0,
"Birds Eye Frozen Mixed Vegetables, Corn, Carrots, Green Beans & Peas, 80 oz. (Frozen)",16654198,14500009371,86,g,,6.92,2.22,0,11.1,67,67,2.2,22,0.4,,,,17,,1110,,,,5.3,,,,,,4.44,0,0,,,
"Great Value Organic Cayenne Pepper, 1.7 oz",50597536,78742131733,,,,4.36,12,17.3,56.6,318,318,27.2,148,7.8,152,293,2010,30,2.48,41600,29.8,0,,76.4,,8.7,80.3,0,51.5,10.3,,3.26,2.45,0,
"Giovanni Rana Homestyle Ravioli Italian Sausage Premium Filled Italian Pasta Bag (Family Size, 18oz)",45048080,877448002923,100,g,18 oz,7.58,8.11,1.35,48.6,243,243,2.7,54,2.92,,,,459,,0,,,,6.5,,,,,,2.7,0,0,,,
"Sara Lee Classic White Sandwich Bread, 20 Oz Loaf of White Bread",10533915,72945601338,57,g,,2.5,8.03,12.7,53.8,362,362,3.4,175,3.72,40,127,218,325,0.94,,1.87,,,0,,3.25,0.8,56,15.6,22.3,,10.4,0.089,0.09,
"Almond Joy Coconut and Almond Chocolate Candy, Jumbo Bag 20.1 oz",10449889,34000042616,nan,nan,,5.94,4.13,26.9,59.5,479,479,5,64,1.27,,112,254,142,,42,,,,0.7,,,,,,48.3,,17.6,,,
"Reese's Miniatures Milk Chocolate Peanut Butter Cups Candy, Share Pack 10.5 oz",305243538,34000432271,nan,nan,,4.84,10.2,30.5,55.4,515,515,3.6,78,1.21,62,161,343,357,1.28,56,0.15,0,,0.3,,4.49,2,0,35.4,47.2,0,10.7,0.1,0.26,
"Activia Peach Probiotic Yogurt, Lowfat Yogurt Cups, 4 oz, 4 Count",10291223,36632026040,113,g,1 lbs/453 g,2.98,3.54,1.33,15.9,88,88,0,133,,,,,49,,,,,,,,,,,,13.3,,0.88,,,
Bonne Maman Raspberry Preserves 13 OZ,14711332,88702015652,20,g,,6.18,0.37,0.07,68.9,,,1.1,20,0.49,4,19,77,32,0.06,0,0.12,0,,8.8,,0.036,0,0,10.2,48.5,,0.01,0.02,0,
"Pure Protein Bars, Chocolate Peanut Butter, 20g Protein, 1.76 oz, 12 Ct",162685700,749826138879,50,g,2.46 oz/70 g,16.94,28.6,14.3,45.7,414,414,7.1,114,2.57,,,271,543,,0,,,,0,,,,,,21.4,0,7.14,,,
"Smucker's Natural Creamy Peanut Butter, 16 Ounces",10308119,51500017005,nan,nan,,4.12,24,49.4,22.7,,,6.32,49.8,1.85,193,393,654,221,3.06,,5.41,,,,,17.2,0,,,,,8.42,0.38,,
"Activia Black Cherry Probiotic Yogurt, Lowfat Yogurt Cups, 4 oz , 4 Count",10291275,36632026354,113,g,1 lbs/453 g,2.98,3.54,1.33,15.9,88,88,0,133,,,,,49,,,,,,,,,,,,13.3,,0.88,,,
"Crisco Butter Flavor All-Vegetable Shortening Sticks, 20 oz",10308190,51500251959,nan,nan,,6.84,0,100,0,917,917,,,,,,,0,,,,,,,,,,,,,0,29.2,,,
"G Hughes Smokehouse BBQ Sauce, Original, 18 oz",438208347,26825000131,30,g,18 ONZ,3.98,0,0,44.4,167,167,2.8,0,2,,,208,639,,0,,,,0,,,,,,30.6,0,0,,,
"Stonyfield® Organic Kids Pear Spinach Mango Whole Milk Yogurt Pouches, 3.5oz, 4 Ct",42700682,52159701123,99,g,14 oz/396 g,5.98,5.05,3.03,12.1,101,101,0,202,0,,,242,81,,101,,40,,0,,,,,,9.09,0,2.02,,,
Popsicle Ice Pops Scribblers 21.6 fl oz 18 Pack,417139397,77567001573,144,g,,5.64,0,0.24,19.7,,,0,5,0.3,3,2,23,13,0.07,,,,,1.2,,,,,,14.6,,,,,
"Veggies Made Great Double Chocolate Muffin, 12oz, 6ct Box (Frozen)",456434412,704863028187,57,g,,5.98,6.54,18.8,50.9,395,395,1.9,163,3.31,36,144,178,339,1.12,,2.29,,,0,,1.91,15.1,28,41.4,26,,4.69,0.046,0.18,
"Stouffer's Spaghetti with Meatballs Meal, 12 oz (Frozen)",10804767,13800103932,357,g,,3.48,5.58,3.39,15.1,113,113,1.5,23,0.93,16,65,179,295,0.93,,0.42,,,6.7,,1.47,6.6,23,14.7,2.88,,1.01,0.101,0.28,
"Lily's Milk Chocolate Style No Added Sugar Baking Chips, Bag 7 oz",743521905,810003460387,14,g,,5.44,9.09,4.5,68.3,,,9.1,909,3.27,410,500,1700,500,13.6,0,0,0,,54.5,,25.6,0,0,267,27.3,0,0,1.82,0,
"Tyson Any'tizers Popcorn Chicken, 1.5 lb Bag (Frozen)",14122355,23700014153,84,g,24 oz/1.5 lbs/680 g,8.77,22.6,13.1,0,214,214,0,0,1.29,,,,464,,0,,,,0,,,,,,0,0,3.57,,,
Ben & Jerry's Brownie Batter Core Chocolate & Vanilla Ice Cream 1 Pint,51316819,76840529872,106,g,,4.48,4.17,11.7,25,225,225,1.7,83,2.25,,,,54,,333,,,,0,,,,,,19.2,0,7.5,,,
"Barilla Classic Angel Hair Pasta, 16 oz",10309182,76808501063,56,g,13.25 oz/375 g,1.76,12.5,2.68,73.2,357,357,10.7,,3.21,143,268,,18,,,,,,,,,,,,3.57,0,0,,,
"El Monterey Bean & Cheese Burritos, 32 oz, 8 Count (Frozen)",15754284,71007061400,113,g,,5.17,7.07,6.3,34,221,221,3.4,52,2.51,31,117,210,351,0.71,68,0.37,0,,0.3,,2.48,7.6,47,22.3,3.21,0.041,1.34,0.085,0.08,
"Sunkist Zero Sugar Orange Soda, 12 fl oz cans, 12 pack",16777403,78000122169,355,ml,12 fl oz,5.38,0,0,0,0,0,,,,,,17,11,,,,,,,,,,,,0,,,,,0
"Little Debbie Pecan Spinwheels, 8 ct, 8.46 oz",16777552,24300041723,30,g,,2.68,8,32.8,55.2,,,,,,,,,223,,,,,,2,,,,,,34,,6.29,,,
"Tru Fru Dark Chocolate Dipped Freeze Dried Fruit Strawberries, 4.2 oz",144486538,850241008026,30,g,3.5 oz/99 g,4.73,3.33,33.3,56.7,500,500,6.7,0,6,,,400,0,,,,,,,,,,,,43.3,0,20,,,40
"Celestial Seasonings Country Peach Passion Herbal Tea Bags, 20 Count",10308608,70734053245,2,g,,3.12,0,0,0,0,0,,,,,,,0,,,,,,,,,,,,0,,,,,
Pompeian Robust Extra Virgin Olive Oil - 68 fl oz,10450625,70404001163,15,ml,68 fl oz/2 L,19.87,0,93.3,0,867,867,,,,,,,0,,,,,,,,,,,,,0,13.3,,,
"Canada Dry Ginger Ale Soda Pop, 2 L bottle",16940514,78000152463,355,ml,7.1 oz/200 g,2.56,0,0,48,180,180,,,,,,,20,,,,,,,,,,,,48,,,,,
"Barilla Wavy Lasagne Pasta, 16 oz",10294353,895059000619,50,g,,2.47,10.5,11.1,12.4,191,191,1.3,185,0.74,24,176,266,524,1.35,685,0.97,,,0.8,,1.76,,,,2.77,0.287,4.37,,0.77,
"Great Value Italian-Style Lasagna with Meat Sauce, 90 oz",24107864,78742033181,213,g,,14.48,10.8,10.7,11.4,185,185,1.5,197,0.79,22,178,255,466,1.32,550,0.91,1,,0.7,,1.84,6.8,17,33.5,3.15,0.312,4.94,0.122,0.66,
"Chef Bombay Butter Chicken with Basmati Rice, 12.5 oz (Frozen Packaged Meal), Egg-Free, One Tray",105385062,818745002186,350,g,,4.16,9.79,3.02,10.9,110,110,0.7,14,0.62,16,104,181,411,0.5,,0.34,,,2.3,,3.82,7.3,14,23.4,1.95,,0.607,0.153,0.09,
"TGI Fridays Honey BBQ Boneless Chicken Bites Frozen Snacks & Appetizers, 15 oz Box Regular",20441607,46704620755,nan,nan,6 oz/170.4 g,7.24,10.6,24.6,52.8,493,493,7,70,1.27,,,,1270,,352,,,,0,,,,,,0,0,3.52,,,
"Pictsweet Farms Recipe Helper Seasoning Blend, Frozen, 10 oz",10849724,70560969024,79,g,10 oz,2,2.35,0,5.88,41,41,3.5,35,0,,,227,35,,,,,,,,,,,,2.35,0,0,,,0
"Thomas' 100% Whole Wheat English Muffins, 6 Count, 12 oz Bag",10448013,48121184070,57,g,,3.48,8.7,2,44.8,223,223,4.6,178,2.87,37,107,186,353,1.07,,0.45,,,0,,3.36,0.8,25,13.7,1.56,,0.287,0.087,0,
"Freshness Guaranteed Garlic Herb French Bread, 14 oz",775786025,200128000009,,,14.8 oz/420 g,1.78,9.43,1.89,43.4,226,226,1.9,0,2.72,,,,698,,0,,,,0,,,,,,3.77,0,0,,,
"Stouffer's Grandma's Chicken and Vegetable Rice Bake Large Family Size Frozen Meal, 55 oz (Frozen)",21048457,13800199904,236,g,36 oz,13.48,7.2,5.51,14.4,136,136,0.4,59,0.68,,,250,314,,,,,,,,,,,,1.69,0,1.91,,,0
"Quaker, Quick 1-Minute Oats, Gluten Free, Select Starts, 18 oz",46955230,30000322567,40,g,24 oz/681 g,4.48,12.5,7.5,67.5,375,375,10,50,3.75,100,325,375,0,,,,0,,,,,,,,0,0,1.25,,,
"Kettle Brand Sea Salt Kettle Potato Chips, Gluten-Free, Non-GMO, 7.5 oz Bag",120871415,84114902153,,,7.5 ONZ,3.58,7.14,32.1,53.6,500,500,7.1,36,1.43,,,1110,643,,,,,,,,,,,,0,0,3.57,,,0
"Nestle Toll House Chocolate Chip Cookie Dough, 36 oz",14528571,50000622641,28,g,,6.47,5.26,23.7,57.9,474,474,0,0,1.89,,,,395,,0,,,,0,,,,,,31.6,0,13.2,,,
"Ragu Homemade Style Pizza Sauce, 14 oz",10291047,36200005507,63,g,14 oz/396 g,1.76,1.59,0.79,7.94,48,48,1.6,21,0.63,,,441,413,,,,0,,,,,,,,4.76,0,0,,,
"A&W Caffeine-Free, Low Sodium Root Beer Soda Pop, 16.9 Fl Oz, 6 Pack Bottles",42294468,78000052428,500,ml,,4.87,0,0,12.4,45,45,0,0,0,,,,18,,0,,,,0,,,,,,12.4,0,0,,,
"Great Value Gluten Free Pancake & Waffle Mix, 16 oz Box",566922754,78742236773,,,,2.62,3.31,4.55,40.3,215,215,1.5,39,0.7,34,306,127,331,0.55,,0.42,,,0.3,,1.55,4.3,0,14.7,4.06,,0.48,0.075,1.62,
"Jovial Brown Rice Fusilli, 12 Oz",30873328,815421011234,57,g,12 oz/340 g,3.96,8.93,3.57,75,357,357,3.6,0,0,,,232,0,,,,0,,,,,,,,0,0,0,,,
"Glutino Gluten Free Pretzel Twists, 14.1 Oz.",29926637,678523040065,30,g,,5.87,2.19,18.8,77.3,,,0,11,0.23,9,32,67,189,0.18,,,,,,,,,,,49.4,0.079,8.09,,,
"Krusteaz Gluten Free Double Chocolate Brownie Mix, Includes Chocolate Chips, 20 oz Box",105684157,41449403366,35,g,20 oz/566 g,4.58,2.86,8.57,82.9,429,429,2.9,29,3.43,,,257,300,,,,11,,,,,,,,57.1,0,2.86,,,57.1
"Oscar Mayer Bun Length Franks Hot Dogs, 8 Ct Pack",40815609,44700075029,53,g,,3.84,11.4,30.3,2.78,329,329,0,10,1.34,13,140,130,1020,2.19,0,,24,,0,,2.29,,0,,1.6,,12.5,0.072,1.63,
"Freshness Guaranteed Yeasty Dinner Rolls, 16 oz, 12 Count",254979420,78742009773,38,g,16 oz/1 lbs/454 g,3.24,7.89,3.95,44.7,263,263,2.6,53,2.63,,,79,395,,,,0,,,,,,79,,7.89,0,0,,,7.9
"Stouffer's Meatloaf Family Size Frozen Meal, 33 oz (Frozen)",10849454,13800190208,156,g,,9.84,10.3,7.05,5.77,128,128,0.6,26,1.09,,,327,353,,,,,,,,,,,,1.28,0,2.88,,,0.6
"Freshness Guaranteed Mini Chocolate Chip Muffins, 12 oz, 12 Count",116315715,78742089355,113,g,12 fl oz,3.48,0,0,11.4,42,42,,,,,,,8,,,,,,,,,,,,11.4,,,,,11.4
"Stouffer's Grandma's Chicken and Vegetable Rice Bake Family Size Frozen Meal, 36 oz (Frozen)",10804841,13800190864,236,g,36 oz,9.84,7.2,5.51,14.4,136,136,0.4,59,0.68,,,250,314,,,,,,,,,,,,1.69,0,1.91,,,0
"Blue Bell Brown Rim Buttered Pecan Ice Cream Half Gallon, 64 fl oz",44391189,71899835486,74,g,1 PINT/473 ML,8.32,4.71,20,17.6,224,224,7.1,106,0.12,,,35,35,,,,0,,,,,,,,0,0,10.6,,,
"Orgain Organic Vegan 21g Protein Powder, Plant Based, Vanilla Bean 1.02lb",553332207,851770003926,46,g,16.2 oz/1.01 lbs/460 g,22.44,45.6,8.7,32.6,326,326,2.2,152,13.9,,,174,587,,,,,,,,,,,,0,0,1.09,,,0
"Quest Protein Bar, Chocolate Brownie, 20g Protein, 4 Ct",52642266,888849003921,60,g,2.46 oz/70 g,8.88,28.6,12.9,45.7,400,400,5.7,57,5.14,,,,429,,0,,,,1.7,,,,,,22.9,0,8.57,,,
Miracle Noodle Ready To Eat Spaghetti Style,186045302,854126008309,100,g,7 oz/200 g,3.98,0,0,3.53,6,6,2.4,24,0,,,0,0,,,,,,,,,,,,0,0,0,,,0
"Atkins Dark Chocolate Royale Protein Shake, High Protein, Low Carb, Low Sugar, Keto Friendly, 12 Ct",756653565,637480069120,325,ml,38 g/190 g,19.48,29,6.58,21,237,237,13.2,289,4.21,,,321,500,,,,0,,,,,,,,2.63,0,1.32,,,
"Hershey's Nuggets Milk Chocolate, Toffee and Almonds Candy, Share Pack 10.2 oz",310344225,34000018758,nan,nan,,4.84,9.76,35.7,51.7,568,568,3.6,,1.5,59,227,471,74,1.34,177,,,,1.8,,0.62,,,,44.6,0.15,17.4,0.07,,
"HORMEL GATHERINGS, Hard Salami and Pepperoni withCheese and Crackers,  28oz Deli Party Tray",21289068,37600330671,,,28 oz,13.98,17.9,46.4,0,500,500,0,0,1.29,,,,1750,,0,,,,0,,,,,,0,0,21.4,,,
"Marketside Premium Heatable Spinach Artichoke Dip Small Tub (16 oz, 1 Count)",37915367,681131457804,30,g,16 oz/454 g/1 lbs,5.54,10,26.7,6.67,300,300,0,200,0,,,,600,,1330,,,,4,,,,,,3.33,0,11.7,,,
"Freshness Guaranteed Garlic Texas Toast, 22.5 oz, 16 Count",685654031,78742323039,40,g,11.25 oz/319 g,3.88,7.5,20,37.5,350,350,2.5,25,2.5,,,100,500,,,,10,,,,,,,,2.5,0,3.75,,,
"Nature's Own 100% Whole Wheat Hamburger Buns, 15 oz, 8 Count",20659493,72250003988,53,g,15 oz/425 g,3.56,11.3,3.77,45.3,245,245,7.5,0,2.83,,,226,358,,,,0,,,,,,,,3.77,0,0.94,,,3.8
"Marketside Chocolate Cookies'n Creme Mousse, 5.25 oz, refrigerated cup",204779055,681131166683,74,g,10.6 oz/300 g,2.44,3.33,30,63.3,500,500,3.3,0,1.2,,,,183,,0,,,,0,,,,,,0,0,6.67,,,
"Pepperidge Farm Jewish Rye Seeded Bread, 16 oz. Bag",10452831,14100071204,32,g,16 OZ/1 LB/454 g,4.38,9.38,3.12,50,250,250,6.2,125,5,,,156,625,,,,0,,,,5,,62,,3.12,0,0,,,3.1
"BetterBody Foods Organic Coconut Aminos Soy Sauce Replacement, 16.9 fl oz",972644366,856260006937,15,ml,16.9 fl oz,10.97,0,0,6.67,67,67,0,33,0.67,,,107,5930,,,,,,,,,,,,6.67,0,0,,,2
"Nestle Toll House Chocolate Chip Cookie Dough, 30 oz",699733721,50000274444,28,g,,4.96,5.26,23.7,57.9,474,474,0,0,1.89,,,,395,,0,,,,0,,,,,,31.6,0,13.2,,,
"Nestle Toll House Milk Chocolate Baking Chips, 23 oz Bag",13448639,28000044251,14,g,3.75 oz,5.18,0,37.5,50,625,625,0,0,0,,,250,0,,,,,,,,,,,,50,0,25,,,50
"Cheez-It Puff'd White Cheddar Cheesy Baked Snacks, 5.75 oz",846767874,24100000197,28,GRM,3 oz/85 g,3.94,7.14,32.1,57.1,536,536,0,143,0,,,250,964,,,,0,,,,,,,,7.14,0,5.36,,,
"Great Value Organic Dill Seed, 1.7 oz",562853188,78742309484,,,,4.58,16,14.5,55.2,305,305,21.1,1520,16.3,256,277,1190,20,5.2,53,,0,,21,,2.81,,0,,,,0.73,0.25,0,
"Ball Park Tailgaters Gourmet White XL Sandwich Buns, 8 count, 21 oz",130713408,50400740143,74,g,2 lbs/907 g,3.74,7.89,3.29,52.6,276,276,1.3,105,2.76,,,79,539,,,,0,,,,4.08,,92,,7.89,0,0.66,,,7.9
Freshness Guaranteed Halloween Brownie Bites 22.2 oz,205117091,78742322230,,,10.5 oz/298 g,6.47,4,16,68,420,420,4,0,2.88,,,,280,,0,,,,0,,,,,,32,0,8,,,
"BOOST Glucose Control Nutritional Drink, Rich Chocolate Nutritional Shake, 15 - 8 fl oz Cartons",321640917,41679109458,,,,26.44,4.22,1.69,17.3,101,101,1.3,127,1.9,42,127,245,63,1.9,,5.7,,,25.3,,1.69,16.9,42,1.6,8.44,,0.422,0.295,0.89,
"Santa Cruz Organic Pure Lemon Juice, 100% Juice, 16 oz, Glass Bottle",30992823,36192122152,5,ml,,3.98,0.45,0.07,5.62,17,17,0.7,10,0.06,7,9,109,24,0.19,,0.23,,,14.3,,0.18,0.1,0,5.1,1.53,,0.027,0.037,0,
"Concord Foods Reconstituted Lime Juice, 4.5 oz",10449044,41409000062,,,,0.98,0.68,0.07,10,42,42,0.3,13,0.09,11,17,180,5,0.05,,0.17,,,41.3,,0.312,0.1,0,5.7,8.47,,0.017,0.074,0,
Trop Drinks Zero Sugar Summer Splash Punch 52.0oz 1ct PET,481570341,48500204979,240,MLT,52 fl oz/1.62 Quart/1.53 L,2.86,0,0,0.42,2,2,,0,,,,56,10,,,,,,37.5,,,,,,0,,,,,
"Great Value Original Beef Jerky, 5 Packs, 1.25 oz Each",636171197,78742297316,35,g,,7.88,33.2,25.6,11,410,410,1.8,20,5.42,51,407,597,1780,8.11,,0.49,,,0,,1.73,2.3,0,109,9,,10.8,0.179,0.99,
"Dr Pepper & Cream Soda, .5 L bottles, 6 pack",843938569,78000033540,,,16.9 fl oz,3.98,0,0,11.2,42,42,,,,,,,16,,,,,,,,,,,,11,,,,,11
"Marketside Fresh Vegetable Medley Blend, 12 oz",13399616,813055011088,,,12 oz/340 g,2.57,2.35,0,5.88,35,35,2.4,35,0.71,,,282,47,,,,0,,48.2,,,,,,2.35,0,0,,,0
"MaraNatha Organic No Sugar No Salt Creamy Peanut Butter, 16 oz",308004483,51651192385,32,g,,5.47,24,49.4,22.7,,,6.32,49.8,1.85,193,393,654,221,3.06,,5.41,,,,,17.2,0,,,,,8.42,0.38,,
"Great Value Organic Ground White Pepper, 2.05 oz",221945655,78742245942,,,,4.36,20.8,0,83.3,208,208,41.7,250,14.2,,,83,0,,,,0,,,,,,,,0,0,0.62,,,
"King Arthur, Unbleached Bread Flour, Non-GMO Project Verified, Certified Kosher, No Preservatives, 5 Pounds",10535108,71012041053,30,g,,5.58,14.3,1.65,72.8,363,363,,19,5.55,35.9,124,127,3,1.06,,,,,,,6.56,,,,,,,0.079,,
"Earth's Best Organic Oatmeal Infant Baby Cereal, 8 oz Box",10318667,23923900172,,,,3.56,7.5,4.9,78.1,,,0.5,15,47.5,112,256,184,7,1.84,0,5,0,,2.4,,31.2,0,0,18,0.12,,0.919,0.47,0,
"Traditional Medicinals, Organic Smooth Move, Tea Bags, 16 Ct",28644880,32917000095,,,,4.92,0,0,0,0,0,,,,,,,0,,,,,,,,,,,,0,,,,,
"LLOYD'S Seasoned and Shredded Beef in Original BBQ Sauce, 15 oz",10293625,78929335886,56,g,16 oz/1 lbs/454 g,5.58,12.5,3.57,14.3,143,143,,36,1.29,,,,750,,,,,,,,,,,,14.3,,1.79,,,
"Jimmy Dean Premium Pork Regular Sausage Roll, 2 lb",10448398,77900117534,56,g,12 oz/340 g,7.97,23.2,35.7,1.79,429,429,0,36,0.64,,,,1070,,,,,,0,,,,,,1.79,0,12.5,,,
"WTRMLN WTR Cold Pressed Watermelon Juice, 12 oz",186544472,852921005004,355,ml,12 fl oz,3.28,0.56,0.28,5.92,25,25,0.3,10,0.28,10,,118,1,,,,,,265,,0.338,,,,4.51,,,,,0
"McCormick Grill Mates Montreal Steak Seasoning, 11.62 oz",302477115,52100038285,0.8,g,,6.82,0,0,27.8,139,139,,,,,,,2000,,,,,,,,,,,,22.2,,,,,
"Woodbridge Chardonnay White Wine, 1.5 L Bottle, 13.5% ABV",10984603,86003873889,,,,11.98,0.07,0,2.16,,,0,9,0.27,10,18,71,5,0.12,,,,,0,,0.108,,,,0.96,0,,0.05,0,
"Juanitas Foods Mexican Style Hominy, 110 oz, Can",10453028,70132006003,130,g,,4.48,1.48,0.88,14.3,,,2.5,10,0.62,16,35,9,267,1.05,1,0.05,0,,0.3,,0.033,0.2,0,3.1,1.51,0,0.123,0.005,0,
"Sky Valley Sriracha Sauce, 18.5 fl. oz.",34274220,896859000885,5,g,19 oz/539 g,4.97,0,0,33.3,167,167,0,0,2,,,,1000,,556,,,,0,,,,,,22.2,0,0,,,
"Hot Pockets Frozen Snacks Hickory Ham and Cheddar Crispy Buttery Crust Sandwiches, 22.5 oz (Frozen)",12166651,43695071443,127,g,,6.97,9.16,15,24.7,,,1.5,152,2,18,168,188,386,0.95,0,0.29,10,,0.1,,3.42,0.8,43,29.1,7.6,0.18,3.54,0.095,0.35,
"Lean Cuisine Pepperoni, Traditional Pizza, 6 oz (Frozen)",10804750,13800047175,170,g,,3.47,12.6,10,31.8,268,268,2.4,172,1.76,26,235,178,591,1.36,,0.73,,,1.8,,2.09,7.4,36,18.2,4.92,,4.3,0.101,0.72,
"BetterBody Foods Organic Coconut Palm Sugar, 24 Oz",296443014,856260006449,4,g,2 lbs/32 oz/907 g,7.44,0,0,100,400,400,0,,,,,1500,75,,,,,,,,,,,,100,0,0,,,
"Great Value Organic Ground Cold Milled Flax Seed, 16 oz",52633655,78742141619,13,g,16 oz/1 lbs/453 g,3.48,20,40,26.7,533,533,26.7,267,6,,,800,33,,,,0,,,,,,,,0,0,3.33,,,0
"Latitude 45 Cold Smoked Atlantic Salmon Loin, 8 oz",764977268,688264996934,,,6 oz/170 g,9.97,21,15.8,0,228,228,0,0,3.51,,,456,965,,,,239,,,,,,,,0,0,2.63,,,
"Freshness Guaranteed Guacamole, Spicy, 15 oz",294570121,681131160742,30,g,,5.23,1.95,14.2,8.45,155,155,6.5,12,0.54,28,51,472,344,0.62,,2,,,10.2,,1.68,20.3,0,13.9,0.72,,2.06,0.251,0,
"Barefoot Pink Moscato Sweet Rose Wine, California, 1.5 Liter Glass Bottle",120718540,85000020609,,,,11.48,0.36,0,3.8,83,83,0,10,0.2,10,18,59,5,0.11,,0,,,0,,0.09,0,0,0,3.8,,0,0.037,0.01,
"Franzia Dark Red Blend Vintner Select Red Wine, 5 L Bag In Box, ABV 13.50%",49933068,83120003359,,,,18.73,0.07,0,2.61,85,85,0,8,0.46,12,23,127,4,0.14,,0,,,0,,0.224,0.4,0,5.7,0.62,,0,0.057,0,
"Sun-Maid California Sun-Dried Raisins, Dried Fruit Lunch Box Snack, 1 oz, 6 Count",430656946,41143120101,28,g,425 GRM,2.44,3.24,0.25,77.9,294,294,4.4,61,1.76,,,730,26,,,,,,,,,,,,64,0,0.09,,,0
"Great Value Family Size Cheese Ravioli, Pasta, 48 oz Bag (Frozen)",28704946,78742031736,145,g,,6.77,6.89,11.1,6.96,,,1,51,0.98,17,135,142,517,0.73,,0.29,,,,,1.38,,,,0.28,0.291,4.28,0.14,0.38,
"Stouffer's Meat and Sauce Lasagna Party Size Holiday Frozen Meal, 90 oz (Frozen)",15561359,13800551313,213,g,90 oz,16.48,6.1,3.76,14.1,113,113,1.4,113,0.7,,,268,263,,,,,,,,,,,,3.76,0,1.64,,,1.9
Pepperoni Pizza Crispy Crust Hot Pocket (Frozen 12-Pack),156799461,43695276329,127,g,,12.97,12,14.2,30.5,298,298,1.8,146,2.14,22,205,199,692,1.54,171,0.78,,,0,,3.84,19.3,,,3.2,,5.27,0.14,0.64,
"Banquet Mega Bowls Dynamite Penne & Meatballs Frozen Meal, 14 oz (Frozen)",607781149,31000809430,nan,nan,,2.98,5.58,3.39,15.1,113,113,1.5,23,0.93,16,65,179,295,0.93,,0.42,,,6.7,,1.47,6.6,23,14.7,2.88,,1.01,0.101,0.28,
"Outshine Strawberry Frozen Fruit Bars, Gluten Free, Individually Wrapped 2.75 fl oz each, 6 Count Package",10794917,41548610047,72,g,2.75 fl oz,3.98,3.39,18.6,32.2,305,305,0,102,0,,,153,102,,,,,,,,,,,,18.6,0,8.47,,,13.6
"Great Value Organic Frozen Blueberries, 10 Oz",12512014,78742112138,140,g,,3,0.42,0.64,12.2,51,51,2.7,8,0.18,5,11,54,1,0.07,,0.48,,,2.5,,0.52,16.4,0,5.1,8.45,,0.053,0.059,0,
"Lean Cuisine Roasted Turkey Breast Meal, 9.75 oz (Frozen)",10804812,13800166616,276,g,,3.47,9.31,1.82,10.6,96,96,1.5,24,0.68,18,85,196,210,0.64,,0.35,,,2.1,,3.63,11.2,2,22.4,3.79,,0.509,0.254,0.11,
"Red Robin Onion Rings, 14 oz (Frozen)",41584932,43301611193,78,g,,4.96,3.15,14.1,30.5,,,1.8,46,0.93,14,49,190,246,0.36,0,,0,,4.6,,0.693,,29,,,,4.53,0.132,0,
"State Fair Classic Corn Dogs, 58.7 oz, 22 Count (Frozen)",12444062,71068160241,76,g,6 LBR,12.48,8,15,30,287,287,0,58,1.49,,,101,640,,,,,,,,,,,,9,0.5,3.5,,,9
"John Morrell Braunschweiger, 16 oz",14710096,70100019356,56,g,16 oz/1 lbs/454 g,3.32,14.3,26.8,5.36,321,321,0,0,6.43,,,,1020,,8930,,,,0,,,,,,5.36,0,10.7,,,
"Checkers / Rally's Famous Seasoned Fries, 48 oz (Frozen)",45618136,43301611315,84,g,,7.98,,,,,,,,,,,,,,,,,,,,,,,,,,,,,
"Great Value Everyday Disposable Plastic Cutlery, White, Assorted, 360 Count",170876960,78742187129,,,8.8 oz/250 g,15.68,6.67,13.3,73.3,467,467,0,0,4.8,,,,800,,0,,,,0,,,,,,6.67,0,0,,,
