BFree White Demi Bread Baguettes 2ct 7.76oz,297679787,852795005902,,,,5.82,8.93,1.79,51.8,250,250,1.8,107,3.57,,,,643,,,,0,,,,,,,,0,0,0,,,
"Great Value Gold Sparkling Sugar, 3.5 oz.",112884374,78742199474,4,g,,1.77,3.45,20.7,62.1,448,448,0,0,1.24,,,52,293,,0,,,,0,,1.38,,,,34.5,0,8.62,,,
"Freshness Guaranteed Decadent Italian Creme Cake, 35 Ounce, Tray",673032190,78742376455,,,,12.96,3.47,11.5,64,374,374,1,24,1.36,8,185,71,470,0.6,17,0.62,4,,0.1,,1.55,9.7,24,37.8,37.3,1.62,4.14,0,0.19,
"Freshness Guaranteed Marshmallow Treat, 18oz, 24 Count, Shelf Stable",727378261,78742322087,21,g,,6.47,0.555,1.22,0.337,,,0,173,0.29,6.78,29.8,30.8,59.6,0.172,,3.32,37.1,,,,0.0744,,,,,0,0.104,0,0.338,
"StarKist Chunk Light Tuna in Water, 12 oz Can",10293459,80000003348,,,,2.72,23.2,0.89,0,107,107,0,,1.29,,,268,446,,,,71,,,,14.3,,,,,0,0,0.214,3.21,
"Stonyfield Organic Kids Strawberry Banana Lowfat Yogurt Pouches, 4 Ct",42700684,52159701253,99,g,3.5 oz,5.98,,2.02,13.1,91,91,0,192,0,,,273,86,,,,,,,,,,,,9.09,0,1.01,,,5.1
Prime Hydration - Meta Moon - 16.9oz - Single,1668216477,850040427103,500,ml,16.9 FL OZ/500 ML,2.18,0,0,1.2,4,4,0,0,0,25,,140,2,,7200,,0,3,,,,,,,0.4,0,0,0.68,0.96,
"Tru Fru Peaches N' Cream, 4.2oz Bag",2492411068,850012117650,,,12 fl oz/354 mL,4.73,0,0,13,51,51,,,,,,,6,,,,,,,,,,,,13,,,,,
"Buffalo Wild Wings Honey BBQ Sauce, 12 fl oz",658134228,70200513266,,,12 oz,3.68,0,0,38.9,167,167,0,25,0,,,100,1060,,,,,,,,,,,,33.3,0,0,,,16.7
"Haagen Dazs Coffee Ice Cream, Gluten Free, Kosher, 1 Package, 14oz",13281759,74570034000,102,g,14 fl oz/414 mL,3.98,7.84,2.45,30.4,176,176,0,196,0,,,,44,,98,,,,0,,,,,,20.6,0,0.98,,,
"Birds Eye Oven Roasters Sweet Potatoes Carrots & Red Potatoes, 14 oz (Frozen)",610196341,14500017819,86,g,14 oz/397 g,2.97,1.16,2.91,15.1,93,93,4.7,0,0.58,,,349,419,,,,0,,,,,,,,3.49,0,0,,,
"MorningStar Farms Meal Starters Grillers Veggie Crumbles, 16.2 oz (Frozen)",939398828,28989104212,55,g,12 oz,5.94,17.3,3.85,7.69,115,115,5.8,115,2.12,,,365,385,,,,,,,,,,,,1.92,0,0,,,0
"Great Value Coffee Ice Cream, 16 fl oz",250267590,78742374000,88,g,,1.63,4.55,13.6,52.3,341,341,2.3,0,1.64,,,0,682,,0,,,,0,,,,,,22.7,0,5.68,,,
"Great Value Hickory Smoked Fully Cooked Bacon, 7 oz",808099531,78742330075,,,4.4 oz/124.73 g,9.94,33.3,46.7,0,533,533,0,0,0,,,,2130,,0,,,,0,,,,,,0,0,16.7,,,
"Sam's Choice Premium Frozen Cooked Medium Shrimp Cocktail Ring with Sauce, 10 oz",48647593,75391052761,,,22 oz/623 g,4.98,10.7,0,6.43,86,86,0,64,0.43,,,,464,,,,0,,,,,,,,5,0,0,,,4.3
"Naked Juice, Green Machine, 64 fl oz Bottle",22880513,82592720641,240,ml,,8.12,0.6,0.26,12.5,,,0.7,11,0.42,10,15,165,6,0.06,428,0.3,0,,8.2,,0.29,21.2,0,4.3,11.2,0,0.053,0.075,0.63,
"Great Value Organic Triple Berry Blend, 10 oz",691227715,78742112268,140,g,48 oz/3 lbs/1.36 kg,2.98,0.71,0,15.7,71,71,5,29,0.26,,,,0,,0,,,,12.9,,,,,,10,0,0,,,
"Great Value Frozen Wild Caught Pacific Cod Fillets, 2 lb",49914105,826504613825,,,,14.46,15.9,0,0,62,62,0,53,0.53,,,,111,,,,0,,,,,,,,0,0,0,,,
"Red Baron Frozen Pizza Brick Oven Supreme, 18.64 oz",720025815,72180566119,132,g,18.64 oz,4.47,8.33,10.6,25.8,227,227,1.5,121,1.67,,,167,545,,,,,,,,,,,,6.06,0,3.79,,,0.8
"Great Value Hickory Smoked Pork Bacon, 48 oz",22210908,78742067940,18,g,,17.87,17.9,44.6,1.79,482,482,0,0,0.64,,,254,1140,,0,,,,0,,,,,,1.79,0,16.1,,,
"Lean Cuisine Steak Portabella Meal, 7.5 oz (Frozen)",10804806,13800156501,212,g,,3.47,6.82,8.4,10.9,146,146,1.2,15,0.84,15,72,179,268,1.5,,0.08,,,5.3,,1.58,4,0,34.5,1.35,,3.88,0.164,0.6,
Birds Eye California Blend Frozen Vegetable Mix Carrots Broccoli Cauliflower 60oz (Frozen),10790988,14500012678,78,g,16 oz/1 lbs/454 g,6.92,1.05,0,6.32,32,32,2.1,26,0,,,116,32,,8000,,0,,15.8,,,,,,2.11,0,0,,,
"Eckrich Jalapeno & Cheddar Smoked Sausage Links, 14 oz",10291668,46600350053,,,,3.48,12,28.2,0.94,,,0,11,0.59,11,157,483,827,1.31,0,0.25,43,,0,,2.81,0,0,61.1,0.94,0.231,9.31,0.179,0.66,
"Great Value Powdered Peanut Butter, 30 oz",664689057,78742232898,12,g,,10.48,2,1,89,373,373,0,23,2,0,8,2,1200,0,,0,,,0,,0,0,0,0.4,5.3,,0.589,0,0,
"Great Value Organic Frozen Steamable Sweet Peas, 10 oz",730824916,78742295718,97,g,10 oz/283 g,1.64,,,,,,,,,,,,,,,,,,,,,,,,,,,,,
Caulipower Cauliflower Crust Cheese Frozen Pizza 11.1oz,157469153,854934007914,157,g,,6.98,11.9,11.1,28.8,263,263,3,228,2.14,24,215,201,471,1.49,,0.74,,,0.1,,1.28,4.2,51,18.9,3.71,,5.7,0.13,0.62,
"Great Value Sugar Cones, 5 Oz, 12 Count",291865651,78742231464,15,g,,1.94,0,0,5.92,24,24,0,0,0.67,1,0,11,10,0.47,,0,,,10.4,,0,0,0,0,1.52,,0,0,0,
Motor City Pizza CO Detroit-Style Deep Dish Pepperoni Pizza 26.17 oz,479098050,870375005005,131,g,27.57 oz/781 g,7.97,12.1,12.9,26.4,264,264,1.4,143,1.93,,,,600,,214,,,,4.3,,,,,,3.57,0,5.71,,,
"Jack Daniel's Seasoned Pulled Chicken, Fully Cooked, Ready to Heat, 16 oz Tray",22583028,895334001089,151,g,420 g,8.94,8.57,9.29,16.4,229,229,0,7,0.71,,,129,493,,,,,,,,,,,,16.4,0,3.57,,,
"Outshine Peach Frozen Fruit Bars, Non-GMO, Gluten Free, Individually Wrapped 2.75 fl oz each, 6 Count Package",44023763,41548517186,70,g,2.75 fl oz,3.98,3.39,18.6,32.2,305,305,0,102,0,,,153,102,,,,,,,,,,,,18.6,0,8.47,,,13.6
"Heinz Tomato Ketchup Value Size, 64 oz Bottle",15754582,13000001212,nan,nan,64 oz,6.98,0,0,29.4,118,118,0,0,0,,,0,1060,,,,,,,,,,,,23.5,0,0,,,23.5
"Impossible Foods Plant Based Frozen Burger Patties, 6 Count, 24oz",637719805,816697023013,,,25.4 OZ/720 g,13.48,15.8,17.5,10,233,233,6.7,158,2.5,67,125,533,342,,,,0,,,,0,,,,0.83,0,4.17,,5,0
"Edwards Premium Desserts, Chocolate Crme Pie, 25.5 oz (Frozen)",10849598,41458105565,90,g,1 pt,3.74,1.9,10.5,32.4,229,229,1,10,0.86,,,48,110,,,,,,,,,,,,23.8,0,6.67,,,22.9
"Sam's Choice Frozen Wild Caught Cold Water Lobster Tails with Butter, 9 OZ",672623096,78742329901,99,g,4 oz,18.98,15.8,0,0,70,70,0,0,0,,,,404,,,,,,0,,,,,,0,0,0,,,
"Lean Cuisine Features Sesame Chicken Meal, 9 oz (Frozen)",10804863,13800654557,255,g,9 oz,3.47,5.88,2.75,22,137,137,0.8,12,0.43,,,90,337,,,,,,,,,,,,5.88,0,0.59,,,5.5
"Ziegenfelder Budget Saver Banana Twin Pops, 42.3 fl oz, 18 Ct",11028277,74534908705,69.4,ml,36 fl oz/1.07 L,3,0,0,16.8,67,67,,,,,,,0,,,,,,,,,,,,14.6,,,,,
"Perdue Harvestland, Organic Chicken Breast Tenderloins, 25g Protein 4oz Svg, 0.8-1.4 lb. Tray",161140228,225683000004,,,,9.17,23.2,0.89,0,107,107,0,18,0.64,,,,67,,0,,,,1.1,,,,,,0,0,0,,,
"Blue Bell Homemade Vanilla Ice Cream Cups, 12 Count",10313796,71899003755,81,g,36 fl oz/1 L,8.94,4.94,9.88,22.2,198,198,0,185,0,,,247,80,,,,0,,,,,,,,22.2,0,6.17,,,14.8
"Frozen Raw US Farm-Raised Catfish Fillets, 2 lb",573833269,788767009602,113,g,15 lbs/6.8 kg,17.98,14.3,5.36,0,98,98,0,0,0,,,,143,,0,,,,0,,,,,,0,0,1.34,,,
"Amy's Kitchen Gluten Free Non-GMO, Chile Relleno Casserole Meal, 9oz Box (Frozen)",118974234,42272011285,255,g,9.0 OZ./255 g,5.68,6.67,7.84,14.5,157,157,0.8,133,1.06,,,169,290,,,,0,,,,,,,,1.57,0,3.53,,,
"HORMEL SQUARE TABLE Roasted Chicken Breasts & Gravy Entre, 15 oz Plastic Tray",10290968,37600287012,142,g,,6.84,14.6,7.65,1.79,134,134,0,6,0.32,17,121,324,883,0.65,0,0.07,,,0,,6.54,0.5,0,,0.43,,2.48,0.298,0.24,
"Magnum Ice Cream Bars Double Caramel 11.1 oz, 6 Count",23816483,77567193421,49,g,,6.14,2.53,21.5,36.7,354,354,2.5,76,2.28,,,,57,,0,,,,0,,,,,,30.4,0,15.2,,,
"Great Value Oven Roasted Turkey Breast Mega Pack, 22 oz",377557466,78742193991,56,g,5 oz/142 g,7.57,20,0,0,86,86,0,0,0,,,,629,,0,,,,0,,,,,,0,0,0,,,
"ICEE Cherry Blue Raspberry Tube, 18 oz, 6 Count (Frozen)",493379349,73321037772,89,ml,18 fl oz/532 mL,3,1.49,2.99,22.4,119,119,0,45,0,,,60,30,,,,,,,,,,,,19.4,0,1.49,,,17.9
"Bryan Hickory Smoke Wieners, 10 Count",10449271,53400210975,34,g,48 oz/3 lbs/1.36 kg,2.62,8.82,20.6,5.88,235,235,0,59,1.06,,,618,794,,,,,,,,,,,,2.94,0,7.35,,,2.9
"Great Value Vanilla Crunch Ice Cream Bars, 2.5 fl oz, 12 Count",660606942,78742366159,92,g,2.5 oz,2.97,0,0,5.63,28,28,0,0,0,,,0,14,,,,,,,,,,,,5.63,0,14.1,,,5.6
"Hillshire Farm Polska Kielbasa Smoked Sausage, 42 oz, Family Size",44391052,44500200270,56,g,,10.98,12.5,26.8,5.36,304,304,1.8,0,1.29,,,482,821,,0,,,,0,,,,,,1.79,0.89,10.7,,,
"Birds Eye Steamfresh Broccoli and Cauliflower, Frozen, 10.8 oz",54027280,14500021328,86,g,10.8 oz,2.52,2.22,0,4.44,33,33,2.2,33,0,,,278,28,,,,0,,,,,,,,2.22,0,0,,,
"Great Value Stuffed Shells Pasta, 32 oz",262180242,78742249230,227,g,,7.98,9.93,8.51,22.2,205,205,0.7,175,1.66,19,172,151,428,0.97,,0.35,,,0,,1.53,0.8,23,48.3,0.53,,4.47,0.072,0.53,
"HORMEL GATHERINGS Snack Tray Honey Ham and Cheese, 14 oz Tray",10535983,37600183673,,,39.7 oz,7.98,17.9,35.7,0,393,393,0,0,1.29,,,,1610,,,,,,21.4,,,,,,0,0,16.1,,,
"KIND Frozen Dark Chocolate Almond Sea Salt Treat Bars, 5 Count",718351457,47677483965,45,g,16.0 fl oz,5.97,4.84,12.9,25.8,,,3.2,,0.89,,,177,194,,,,0,,,,,,,,15.3,0,4.84,,,10.5
"Hershey's Zero Sugar Chocolate Baking Chips, Bag 8 oz",10312014,34000141340,nan,nan,,3.98,2.87,2.03,14.2,43,43,2.9,0,2.06,74,113,388,343,0.99,0,0.02,0,,0,,0.371,0.4,0,1.8,0.27,0,0.746,0.018,0,
"Drumstick We Love Chocolate Cookie Dipped Variety Pack Frozen Dessert, No Artificial Flavors or Colors, Kosher, 8 Ct Package",49606947,72554721830,,,,7.48,3.13,28,51.8,456,456,9.9,11,1.51,51,100,361,285,0.71,,0,,,0,,0.697,0,0,19.3,36.8,,26.4,0.03,0,
"Sam's Choice Angus Vidalia Onion Beef Patties, 6 - 1/3 Pound Beef Patties, 2 Pound Box",10315839,78742028989,151,g,,9.96,,,,,,,,,,,,,,,,,,,,,,,,,,,,,
"Sola Low Carb, No Added Sugar Hot Dog Buns, 9 oz, 4 Count",150703182,851921006509,64,g,,4.98,8.58,15,8.29,203,203,1.7,25,1.25,20,103,293,628,1.44,,0.5,,,0.1,,1.37,3.3,0,26.9,1.58,,6.03,0.105,0.54,
"Great Value Cookies & Cream Ice Cream, 16 fl oz",573971200,78742372976,89,g,,1.63,4.61,14.1,43.4,317,317,1.7,70,1.5,22,86,170,232,0.64,,0.83,,,0.3,,0.956,2,22,16.5,26.4,,6.42,0.036,0.21,
"Hillshire Farm Sliced Honey Roasted Turkey Breast Deli Lunch Meat, 22 oz",731622475,44500201987,56,g,,9.47,17.9,0.89,7.14,107,107,0,0,1.29,,,,679,,0,,,,0,,,,,,5.36,0,0,,,
"Sam's Choice Bone-in Spiral-Cut Ham, 8 - 14.6 lb",20512805,220950000008,,,,26.56,22.1,7.27,0,160,160,0,21,1.65,11,196,263,35,3.86,0,0.28,3,,0,,5.76,1.3,0,54.3,0,0.303,2.78,0.634,1.79,
Blue Ribbon Classics Orange Dream Frozen Treat Bar,10805024,70640300129,50,g,16 fl oz/473.2 mL,6.48,5,1.67,30,150,150,5,200,0,,,233,82,,,,0,,,,,,,,16.7,0,0.83,,,11.7
"Oscar Mayer Lean Smoked Ham Deli Lunch Meat with Water Added, 16 Oz Package",10292653,44700019030,65,g,,6.64,16.8,4.04,0.7,,,0,5,0.59,19,252,463,945,1.51,0,0.29,25,,0,,5.7,0,0,62.4,0,0.014,1.23,0.394,0.36,
Ben & Jerry's Non-Dairy Frozen Dessert Milk & Cookies 1 Pint,436377613,76840002283,132,g,,4.48,0.86,9.07,18.3,157,157,0,119,0.27,7,24,44,41,0.14,,1.62,,,0,,0.132,0.7,0,6.9,17.9,,7.11,0.007,0.38,
"Haagen Dazs Strawberry Ice Cream, Gluten Free, Kosher, 1 Package, 14oz",15754295,74570024001,104,g,,3.98,3.13,28,51.8,456,456,9.9,11,1.51,51,100,361,285,0.71,,0,,,0,,0.697,0,0,19.3,36.8,,26.4,0.03,0,
"Amy's Kitchen Non-Dairy Bean & Rice Burrito, 6 oz (Frozen Pouch)",46491648,42272000708,170,g,,3.18,0.86,9.07,18.3,157,157,0,119,0.27,7,24,44,41,0.14,,1.62,,,0,,0.132,0.7,0,6.9,17.9,,7.11,0.007,0.38,
"Oroweat Organic Bread 100% Whole Grain Bread Loaf, 27 oz",187515701,73410026335,48,g,,5.48,10.7,2.15,43.9,238,238,9.2,684,4.89,26,103,127,478,0.95,,0.38,,,0,,4.46,7.7,49,8.1,5,,0.63,0.08,0,
"Jimmy Dean Hot Sausage and Salsa Verde Breakfast Bowl, 7 oz (Frozen)",323004872,77900001413,198,g,198.446 GRM,2.97,13.1,12.6,9.09,202,202,1,120,1,,,268,458,,,,,,,,,,,,0.5,0,5.05,,,0.1
"StarKist Smart Bowls Tuna, Rice and Beans, Spicy Pepper, 4.5 oz Pouch",602117229,80000519726,128,g,4.5 OZ/128 g,1.42,8.59,2.34,18.8,133,133,3.1,22,1.02,,,328,469,,,,3,,,,6.25,,,,1.56,0,0.39,0.156,1.88,
Sunbeam Enriched Jumbo Seeded Sandwich Rolls 8 ct Bag,10451524,77633063344,,,12 oz/340 g,4.12,9.3,3.49,55.8,279,279,2.3,186,3.35,,,93,535,,0,,,,0,,4.65,,,,6.98,0,0,,,
Twix Ice Cream Bars 6-Count Box,19399931,47677301238,45,g,12.0 fl oz,4.48,6.25,22.9,41.7,,,2.1,,1.67,,,271,125,,,,0,,,,,,,,33.3,0,14.6,,,29.2
"Skylark Sliced Calf Liver, 16 oz",10534062,79041221156,,,,3.68,20.4,3.54,3.54,133,133,0,0,4.78,,,,71,,16800,,,,1.1,,,,,,0,,1.33,,,
"Haagen Dazs Vanilla Milk Chocolate Almond Ice Cream Bars, Gluten Free, Kosher, 3 Count Package",15681020,74570033102,82,g,,3.98,4.1,24.1,24.5,331,331,0.8,119,0.29,28,173,305,68,0.82,,0.42,,,0,,0.175,1.3,0,29.7,18.3,,13.2,0.043,0.49,
"Great Value Organic Ground Turmeric, 1.0 oz",50597546,78742131689,,,,4.36,9.68,3.25,67.1,312,312,22.7,168,55,208,299,2080,27,4.5,0,4.43,0,,0.7,,1.35,13.4,0,49.2,3.21,0.056,1.84,0.107,0,
"Great Value Sugar Free Variety Flavor Junior Ice Pops, 1.65 fl oz, 20 Count (Frozen)",788513106,78742366135,,,,2.48,1.37,2.33,12,49,49,7.5,23,0.03,,,,6,,0,,,,0,,,,,,0.43,,2,,,
"Gardein Ultimate Plant-Based Vegan Chick'n Filets, 15 oz (Frozen)",733799556,842234002326,140,g,15 oz/425 g,7.92,15.5,9.15,19,218,218,0.7,21,2.39,,,85,634,,,,0,,,,,,,,0.7,0,0.7,,,0.7
"PBfit Peanut Butter Powder, 24oz",134878459,856260006005,12,g,,13.93,2,1,89,373,373,0,23,2,0,8,2,1200,0,,0,,,0,,0,0,0,0.4,5.3,,0.589,0,0,
"Amy's Kitchen Gluten Free, Vegan, Bean & Rice Burrito, 5.5 Oz Pouch (Frozen)",45067843,42272003525,156,g,,3.58,7.07,6.3,34,221,221,3.4,52,2.51,31,117,210,351,0.71,68,0.37,0,,0.3,,2.48,7.6,47,22.3,3.21,0.041,1.34,0.085,0.08,
"Great Value Silver Sanding Sugar, 3.3 oz",558357469,78742199467,4,g,2.6 oz/75 g,1.77,0,0,100,375,375,,,,,,,0,,,,,,,,,,,,100,,,,,100
"Great Value Mini Sugar Pearls, White, 2.95 oz",576331742,78742199405,,,,2.33,3.45,20.7,62.1,448,448,0,0,1.24,,,52,293,,0,,,,0,,1.38,,,,34.5,0,8.62,,,
"Grobbel's Fresh Corned Beef Brisket Flat, 1 Count, 2.0- 5.0 lbs",652599827,201037000005,,,,19.36,18.2,19,0.47,,,0,8,1.86,12,125,145,973,4.58,0,0.16,4,,0,,3.03,1.5,0,69.2,0,,6.34,0.23,1.63,
"Pork Center Cut Loin Chops Thick Boneless, 0.8 - 2.0 lb Tray",51259109,209503000009,,,15 oz/425 g,9.57,18.8,7.98,1.41,155,155,,19,0.51,,,,221,,,,,,,,,,,,,,2.82,,,
"Klondike Frozen Heath Dairy Dessert Bars Ice Cream, 4 oz 6 Count",10801682,75856011135,73,g,,4.24,0.86,9.07,18.3,157,157,0,119,0.27,7,24,44,41,0.14,,1.62,,,0,,0.132,0.7,0,6.9,17.9,,7.11,0.007,0.38,
Food For Life Ezekiel 4:9 English Muffins Cinnamon Raisin - 6 CT,128321601,73472001172,38,g,,8.33,7.91,1.8,48.1,240,240,2.6,114,4.5,23,91,173,299,0.97,0,0.31,0,,1.3,,3.67,2.5,54,16,14.8,0,0.54,0.066,0,
"Blue Bell Gold Rim Cookies 'n Cream Ice Cream Pint, 16 fl oz",44391360,71899051015,79,g,1.5 QTS/1.42 L,3.97,3.49,10.5,24.4,198,198,0,112,0,,,180,76,,,,0,,,,,,,,22.1,0,5.81,,,16.3
"Impossible Foods Homestyle Meatballs, 14oz",508837620,816697023044,85,g,,7.28,9.77,8.45,26,,,2.1,176,2.32,29,97,275,437,1.19,292,0.79,1,,0.4,,3.55,6.6,49,32.9,4.98,0.421,3.12,0.132,0.55,
"Toufayan Keto Flat Bread, 5 Count",1653657209,73124013072,,,8.9 oz/252 g,4.68,14,9,36,280,280,26,160,1.4,,,60,620,,,,0,,,,,,,,0,0,2,,,
"Marketside Decadent Dark Chocolate Cookies, 13.5 oz, 6 Count",888249777,681131411509,32,g,,4.98,9.86,0.7,53.5,254,254,4.2,0,1.01,,,,338,,,,,,0,,,,,,1.41,0,0,,,
"Old Wisconsin Beef Sausage Snack Sticks, 7 Oz",156002100,73170776228,16,g,28 oz/1.75 lbs/794 g,4.54,16,32,4,400,400,0,0,1.44,,,,1280,,0,,,,0,,,,,,4,0,14,,,
"Marketside Decadent Chocolate Candy Bar Cookies, 13.5 oz, 6 Count",456953874,681131411516,32,g,,4.98,9.86,0.7,53.5,254,254,4.2,0,1.01,,,,338,,,,,,0,,,,,,1.41,0,0,,,
"Larabar Peanut Butter Chocolate Chip, Gluten Free Fruit & Nut Bar, 12 Ct",506079785,21908122854,45,g,1.6 ONZ,12.94,11.8,26.1,52.5,492,492,8.6,58,3.73,,,558,154,,,,,,,,,,,,36.1,0,7.03,,,8.4
Extraordinary Bites Wheat Bread,218998415,673497008301,25,g,,5.94,10.7,4.53,47.5,,,4,125,3.6,41,129,141,473,1.04,2,0.19,0,,0.2,,5.59,4.9,20,18.7,5.73,0.033,0.697,0.111,0,
Mission Uncooked Fajita 16Ct,1675428736,73731060124,37,g,,3.58,8.7,6,49.6,,,,191,1.99,,,,898,,,,,,,,,,,,,,0.695,,,
Sunbeam Hamburger Buns 12 oz. Bag,23591293,77633063283,,,,3.83,8.97,3.21,52.6,269,269,1.3,90,2.95,,,77,462,,,,0,,,,4.23,,90,,5.13,0,0.64,,,5.1
Ben & Jerry's Karamel Sutra Core Ice Cream 1 Pint,10453085,76840101542,107,g,1 PT/473 mL,4.48,4.23,13.4,31,261,261,1.4,127,1.48,,,289,67,,,,,,,,,,,,26.8,0.35,9.15,,,21.8
"Marketside Honey Bun Cake, 28 Ounce Base and Dome",937714347,681131411363,,,,7.68,4.45,26.6,48.6,452,452,1.2,183,1.37,14,131,102,305,0.53,2,1.15,0,,0.3,,2.4,15.2,53,10.6,25.7,0.295,12.6,0.038,0.16,
Extraordinary Bites Hawaiian Rolls 8ct.,253594880,673497002040,28,g,15 oz/425 g,5.94,8.57,4.29,40,286,286,2.9,80,2.86,,,31,357,,,,0,,,,5.71,,,,14.3,0,0,,,14.3
"Extraordinary Bites Hamburger Buns 6 count - Low Carb, Great Taste, All Natural Ingredients 9oz bag",545743719,673497008257,43,g,,5.94,1.34,22.8,17.1,272,272,0.6,18,0.43,13,33,190,845,0.21,,1.9,,,2.5,,0.917,50.8,0,20,13.1,,3.54,0.104,0.04,
"Stone Mill Bread Sourdough, 28 oz",142305346,756778343220,28,g,,5.68,10.8,2.42,51.9,,,2.2,52,3.91,32,105,117,602,1.04,1,0.21,0,,0,,4.82,0.7,67,8,4.62,0.005,0.529,0.107,0,
"Freshness Guaranteed Fudge Brownies 13 oz Clamshell, 4 Count",151438938,78742299020,30,g,13.9 ONZ,4.48,5.69,8.83,73.4,396,396,2.8,44,3.39,,,304,314,,,,,,,,,,,,50.8,0.1,3.69,,,49.4
"Toufayan Bakeries Pita Bread, 5 Loaves",1305394491,73124013164,,,,4.68,9.1,1.2,55.7,275,275,2.2,86,2.62,26,97,120,536,0.84,,0.3,,,0,,4.63,0.2,83,14.6,1.3,,0.166,0.034,0,
Country White - Stone Mill Bread,191686454,756778331135,28,g,,5.68,9.43,3.59,49.2,267,267,2.3,211,3.36,27,113,117,477,0.88,,0.22,,,0,,4.76,0.2,86,14.6,5.34,,0.821,0.092,0,
Light Wheat - Stone Mill Bread,192435433,756778334334,28,g,,5.68,10.7,4.53,47.5,,,4,125,3.6,41,129,141,473,1.04,2,0.19,0,,0.2,,5.59,4.9,20,18.7,5.73,0.033,0.697,0.111,0,
Cranberry Pecan,119815522,756778338332,28,g,,7.48,9.17,72,13.9,,,9.6,70,2.53,121,277,410,0,4.53,56,1.4,0,,1.1,,1.17,3.5,0,40.5,3.97,,6.18,0.21,0,
Woodstock - Stone Mill Bread,195662101,756778332330,,,17 oz/481 g,5.98,16.2,8.11,67.6,405,405,8.1,108,3.89,,,,568,,0,,,,0,,,,,,10.8,0,0,,,
"Nature Valley Protein Granola Bars, Snack Variety Pack, Chewy Bars, 15 ct",274787674,16000106123,,,,10.96,5.71,11.4,72.3,,,3.8,116,8.71,63,168,189,185,1.35,1010,2.66,0,,0.1,,5.44,7.5,72,28.6,42.9,0,1.44,0.52,0,
"Jolly Time Blast O Butter Theatre Style Butter Microwave Popcorn 3.2 oz, 6 Ct. Gluten-Free Non-GMO",10536008,28190007296,33,g,19.2 oz/544 g,3.88,6.06,30.3,54.6,485,485,9.1,,1.52,,,,1030,,,,,,,,,,,,0,,15.2,,,
"Sunsweet Amazin Prunes, Pitted, 16 Oz",51727071,802763028846,40,g,18 oz/510 g,6.48,2.5,0,65,250,250,7.5,50,0.9,,,725,0,,750,,,,0,,,,,,37.5,0,0,,,
"Success Rice Boil-in-Bag Brown Rice, Whole Grain, 14 oz",10290888,17400100780,50,g,14 oz/396 g,2.48,8,3,78,360,360,4,0,0.72,120,,140,0,2.4,,,,,0,,4,,,,0,0,0,,,
"Great Value Organic 100% Tart Cherry Juice, 32 fl oz",10315766,78742015118,240,ml,,5.58,0.31,0.54,13.7,59,59,,13,0.42,11,17,161,4,0.03,,,0,,0,,,,,,12.2,,,0.037,0,
"LightLife - Smart Dogs, 12oz",10801150,43454100803,42,g,,4.28,0,2.1,7.1,47,47,0,,,,0,26,829,,5770,0.2,,,,,,4.2,,,1,0.04,0.31,,,
"Johnsonville Jalapeno & Cheddar Smoked Sausage, 12 Links, 1 lb 12 oz",44664701,77782000832,66,g,,7.68,12,28.2,0.94,,,0,11,0.59,11,157,483,827,1.31,0,0.25,43,,0,,2.81,0,0,61.1,0.94,0.231,9.31,0.179,0.66,
"Catalina Crunch Dark Chocolate Keto Cereal, 9oz Bags",590919239,860479001546,26,g,,6.98,4.31,5.53,82.1,398,398,2.7,8,9.92,27,83,97,701,0.65,,0.51,,,0,,12.5,6.4,300,7.7,42.8,,1.51,1.36,1.8,
"Bobo's Oat Bites, Chocolate Chip, 5 Pack of 1.3 oz bars",46409795,829262000333,37,g,,3.86,5,10,69.8,,,22.5,250,0.9,190,419,447,237,1.96,0,1.47,0,,1.2,,7.9,2.6,12,12.4,25,0.007,3.4,0.963,0,
"Great Value Frozen Traditional Hushpuppies, 1.5 lb",239477987,78742253053,49,g,24 oz/680 g,5.78,3.85,11.5,42.3,288,288,1.9,31,1.92,,,96,750,,,,0,,,,,,,,5.77,0,1.92,,,3.8
"Gardein Ultimate Plant-Based Vegan Chick'n Tenders, 15 oz (Frozen)",648964963,842234002340,96,g,15 oz/425 g,7.92,14.8,9.9,18.8,228,228,1,0,2.38,,,0,624,,,,0,,,,,,,,0.99,0,0.99,,,
"Gardein Plant-Based, Vegan Classic Meatless Meatballs, 12.7 oz (Frozen)",46615897,842234000971,90,g,10.5 oz/300 g,4.92,14.4,12.2,10,189,189,3.3,78,2.22,,,311,500,,,,0,,,,,,,,1.11,0,1.11,,,
"CAULIPOWER, Cauliflower Crust Buffalo Sauce Chicken Pizza, 10.9 oz",823075302,854934007631,155,g,18.0 oz,6.98,1.47,0.49,24.5,108,108,2.5,15,0.25,,,88,147,,,,,,,,,,,,2.45,0,0,,,0.5
Sams Choice Frozen Mussels 2lb,435222224,78742253527,,,,6.22,15.1,2.84,4.67,109,109,0,33,5,43,249,405,362,2.02,,0.7,,,8.1,,1.92,0.1,0,82.3,0,,0.538,0.057,12.9,
"Freshness Guaranteed Guacamole, Spicy, 8 oz",572154678,681131160711,30,g,,2.98,1.95,14.2,8.45,155,155,6.5,12,0.54,28,51,472,344,0.62,,2,,,10.2,,1.68,20.3,0,13.9,0.72,,2.06,0.251,0,
"Great Value Organic Onion Powder, 2.3 oz",50597563,78742131894,,,,4.36,10.4,1.04,79.1,341,341,15.2,384,3.9,113,322,985,73,4.05,0,0.27,0,,23.4,,0.321,4.1,0,39,6.63,0,0.219,0.718,0,
"Marketside Biscuit-Crust Savory Breakfast Pizza, Medium, 38.2 oz (Fresh)",302042625,681131295833,135,g,,9.42,9.97,8.44,30.7,238,238,2.2,165,2.19,22,189,162,520,1.18,,0.72,,,6.2,,3.38,5.9,45,15,4.4,,3.88,0.083,0.36,
"Gardein Plant-Based, Vegan Meatless Chick'n Strips, 10 oz (Frozen)",129819732,842234001626,98,g,10 oz/283 g,4.92,16.7,6.67,4.44,144,144,0,33,2.11,,,0,411,,,,0,,,,,,,,1.11,0,0.56,,,
"Marketside Butcher Ground Lamb, 80/20, 1 lb (Fresh)",695704617,681131160650,,,,6.88,,,,,,,,,,,,,,,,,,,,,,,,,,,,,
"Great Value Smoked Ham, 32 oz",22282311,78742024509,56,GRM,,7.42,19.4,54.8,16.1,613,613,9.7,258,3.48,,,677,484,,0,,,,0,,,,,,3.23,0,4.84,,,
"HORMEL Chili with Beans, 38 oz",15673599,37600236133,247,g,25 oz,4.86,6.88,3.64,12.6,109,109,2.8,24,0.73,,,,401,,,,,,0,,,,,,2.02,0,1.42,,,
"Impossible Foods Plant Based Frozen Savory Sausage Roll, 14oz",525109109,816697023020,56,nan,,4.98,13.3,19.1,2.58,234,234,0.4,11,1.12,16,112,327,863,1.77,,1.06,,,2,,4.55,0.8,0,46.1,1.82,,6.17,0.164,0.68,
"Breyers Frozen Dairy Dessert Cookies & Cream Ice Cream Alternative, 48 oz",10898719,77567224828,82,g,,4.67,3.68,6.2,21.9,143,143,0.5,133,0.09,,,,66,,291,,,,0.8,,,,,,6.09,,3.9,,,
"Jimmy Dean Simple Scrambles Turkey Sausage Quick Breakfast Cup, 5.35 oz",385979712,77900650543,151,g,151.67 GRM,3.18,15.9,13.9,1.32,194,194,0,132,1.19,,,136,479,,,,,,,,,,,,0.66,0,6.62,,,0.1
"Outshine Strawberry, Lime, and Raspberry Frozen Fruit Bars Variety Pack, Non-GMO, Gluten Free, Individually Wrapped 1.5 fl oz each, 12 Count Package",10794920,41548620107,137,g,9 ONZ,5.64,0.05,5.14,80.4,368,368,0.5,13,0.21,,,79,237,,,,,,42.9,,,,,,45.2,0.02,3.53,,,40.7
Thai Kitchen Gluten Free Lite Coconut Milk,23591412,737628011605,80,ml,13.66 fl oz/403 mL,2.58,0,15,1.25,150,150,0,0,0.45,,,,19,,0,,,,0,,,,,,1.25,0,12.5,,,
Talenti Sorbetto For a Delicious Non-Dairy Ice Cream Alternative Roman Raspberry Made With Non-GMO Ingredients 1 pint,107540677,186852000822,130,g,1 PT/473 mL,4.93,0.77,0,28.5,115,115,3.1,0,0.28,,,54,0,,,,0,,,,,,,,25.4,0,0,,,23.1
"Great Value Organic Ground Cumin, 1.7 oz",50597550,78742131818,,,2 oz/58 g,4.36,0,0,0,0,0,,,,,,,0,,,,,,,,,,,,,,,,,
Sweetened Condensed Coconut Mlk,165316733,70650060402,38,g,,2.48,7.91,8.7,54.4,321,321,0,284,0.19,26,253,371,127,0.94,,0.16,,,2.6,,0.21,0.6,0,89.1,54.4,,5.49,0.051,0.44,
"Totino's Pizza Rolls, Combination, Frozen Snacks, 48.85 oz, 100 CT",934492849,42800118363,,,,9.42,7.06,9.41,34.1,247,247,2.4,24,2.12,,,,412,,235,,,,0,,,,,,2.35,0,1.76,,,
"Great Value Organic Chopped Spinach, 10 oz (Frozen)",196427048,78742133140,85,g,,1.97,4.01,0.87,4.8,,,3.7,153,1.96,82,50,302,322,0.49,12100,3.54,0,,2.2,,0.439,541,0,24.8,0.51,0,0.036,0.136,0,
"Truvia Cane Sugar Blend, Mix of Stevia Sweetener and Cane Sugar (24 oz Bag)",20461315,13600000745,nan,nan,,6.88,0,0,100,312,312,,,,,,,0,,,,,,,,,,,,75,,,,,75
"Jimmy Dean Bacon Egg & Cheese Biscuit Sandwich, 28.8 oz, 8 Count (Frozen)",36073881,77900501784,102,g,,11.62,9.29,22.9,21.1,328,328,2,137,1.84,15,302,292,589,0.94,,,,,,,2.18,,,73.6,3.1,0.177,8.6,0.123,0.64,
"Oscar Mayer Deli Fresh Black Forest Uncured Sliced Ham Deli Lunch Meat Family Size, 16 Oz Package",33283611,44700072615,56,g,9 oz,6.78,21.4,2.68,3.57,125,125,0,0,1.29,,,,821,,,,,,16.1,,,,,,3.57,0,0.89,,,
"Great Value Biscuit Sandwiches Bacon Egg and Cheese, 4 Count (Frozen)",47041337,78742101910,105,g,,5.78,13,20.5,19.6,316,316,1.1,154,1.87,17,372,168,811,1.31,,0.93,,,0,,2.65,4.1,23,96.7,2.07,,9.97,0.119,0.55,
"MorningStar Farms Grillers Veggie Burgers, 18 oz (Frozen)",49028498,28989100801,64,g,,7.94,23.9,9.3,8.5,213,213,4.4,61,4.2,,185,182,422,1.2,0,,,,0,,6.4,,,,1.2,0,1.7,0.6,4.5,
"MorningStar Farms Grillers Veggie Burgers, 9 oz (Frozen)",50039778,28989100825,64,g,,4.58,23.9,9.3,8.5,213,213,4.4,61,4.2,,185,182,422,1.2,0,,,,0,,6.4,,,,1.2,0,1.7,0.6,4.5,
"Sam's Choice Frozen Ahi Tuna Steaks, 1 LB",35192960,78742126685,113,g,4 oz/113 g,6.42,24.8,0.44,0,110,110,0,18,0.64,,,,45,,88,,,,1.1,,,,,,0,0,0,,,
"Bush's Blackeye Peas with Bacon, Canned Black Eyed Peas, 15.5 oz",10306761,39400013587,130,GRM,15.5 ONZ,1.36,5.77,1.03,13.2,81,81,2.3,26,1.84,,,248,378,,,,,,,,,,,,1.53,0,0.35,,,0
"Great Value High in Antioxidant Fruit Blend, 40 Oz",774476466,78742346151,140,g,,9.48,0.34,0.03,11.4,46,46,0.1,9,1.12,6,10,111,4,0.04,,0.06,,,27,,0.075,0.1,0,0.5,8.12,,0.002,0.019,0,
"DiGiorno Supreme, Stuffed Crust Pizza, 26.4 oz (Frozen)",51409814,71921825881,150,g,,8.96,11.7,10.7,27.9,,,2.3,139,1.01,27,211,210,712,1.3,117,0.89,,,,,1.6,7.6,,,4.71,0.143,3.96,0.137,0.41,
"StarKist Smart Bowls Tuna, Quinoa and Beans, Latin Citrus, 4.5 oz Pouch",517155842,80000519702,128,g,4.5 OZ/128 g,1.42,7.81,3.12,18,125,125,3.9,20,1.02,,,250,469,,,,,,,,3.91,,,,1.56,0,0.78,0.156,1.64,0.8
"Tyson All Natural, Fresh Pork Shoulder Butt Roast, Bone in, 6.84 - 8.3 lb, 6.84 - 8.3 lb",21501691,220835000000,,,32.03 LBR,14.55,17.9,12.5,0,188,188,,,,,,,62,,,,,,,,,,,,,,4.46,,,
"Healthy Choice Power Bowls Basil Pesto Chicken with Riced Cauliflower, 9.25 oz (Frozen)",358820788,72655002524,262,g,,3.98,2.53,0.55,5.71,,,0.8,15,0.09,,,,181,,334,,,,1,,,,,,0.37,0,0.17,,,
"Totino's Pizza Rolls, Triple Cheese Flavored, Frozen Snacks, 100 ct",199021676,42800118349,,,,9.42,7.06,9.41,34.1,247,247,2.4,71,2.12,,,,329,,353,,,,0,,,,,,2.35,0,2.35,,,
