"Fresh Gourmet Crispy Jalapenos, Salads Toppings, 3.5 oz",163519708,787359175121,7,g,0.5 oz/14 g,2.78,7.14,42.9,42.9,571,571,0,0,2.57,,,,214,,0,,,,17.1,,,,,,0,0,0,,,
"Great Value Buttermilk Ranch Dressing, 36 fl Oz",10452504,78742075211,30,ml,8 fl oz,3.48,0,0,16.7,33,33,3.3,,,,,,900,,,,,,,,,,,,,,,,,
"ParmCrisps Gluten-Free Original Oven-Baked Parm Crisp Cheese Crackers, 1.75 oz",372694550,893222000305,18,g,,2.98,12.1,15.6,64.3,446,446,16.2,223,3.17,198,422,477,587,2.95,,,,,,,5.39,,,,1,,,,,
"Alessi Italian/Asian Fusion Balsamic Reduction, 8.5 Fluid Ounce",573363485,71072021743,20,ml,,4.98,,,,,,,,,,,,,,,,,,,,,,,,,,,,,
"Great Value Light Buttermilk Ranch Dressing & Dip, 16 fl oz",10452401,78742228983,30,ml,16 fl oz/1 PT/473 mL,1.97,0,10,6.67,117,117,,,,,,,933,,,,,,,,,,,,3.33,,1.67,,,
"McCormick Brown Gravy Seasoning Mix, 21 oz Gravies",28273204,52100106199,6,g,,9.62,12.5,6.25,62.5,375,375,,,,,,,4880,,,,,,,,,,,,,,,,,
"Kraft Creamy French Salad Dressing, 16 fl oz Bottle",10295681,21000642823,nan,nan,,2.98,0.6,32.9,8.5,334,334,0.1,6,0.2,,58,52,633,,185,,,,0.3,,,155,,,4.2,,5,,,
"Western Original Sweet & Smooth French Salad Dressings, 24 fl oz",43596590,41321301810,30,ml,1 GAL/128 fl oz/3.78 L,4.12,0,40,36.7,500,500,0,0,0,,,,733,,,,0,,,,,,,,36.7,0,5,,,36.7
Ken's Steak House Lite Raspberry Walnut Vinaigrette Salad Dressing 16 fl oz,10307554,41335001270,32,g,24 fl oz/1.5 PT/710 mL,3.28,0,15,10,200,200,0,0,0,,,,1030,,0,,,,0,,,,,,10,0,1.67,,,
"BRIANNAS Rich Poppy Seed Dressing, 12 fl oz",10447938,27271112287,31,g,,3.48,0.92,33.3,23.7,399,399,0.3,59,0.25,9,49,61,933,0.25,,2.36,,,0.3,,0.047,50.2,0,6,23.4,,6.06,0.022,0.09,
"Wish-Bone Zesty Robusto Italian Salad Dressing, 15 fl oz",55500611,41321006258,30,ml,8 fl oz/237 mL,2.58,0,,,,,0,0,0,,,,,,0,,,,0,,,,,,,0,,,,
"Kraft Sun Dried Tomato Vinaigrette Salad Dressing, 16 fl oz Bottle",10295341,21000002849,nan,nan,,2.98,14.1,2.97,55.8,258,258,12.3,110,9.09,194,356,3430,107,1.99,,0.01,,,39.2,,9.05,43,0,105,37.6,,0.426,0.332,0,
"Ken's Steak House Creamy Caesar Salad Dressing, 16 fl. oz.",10307559,41335001768,30,g,,3.28,4.23,3.57,6.78,76,76,1.8,114,0.99,17,89,244,225,0.65,,0.18,,,4,,0.496,88.7,3,10.5,1.23,,1.67,0.078,0.13,
"Hidden Valley Original Ranch Dipping Sauce Salad Dressing and Topping, 20 fl oz",10413778,71100000214,30,ml,12 fl oz/354 mL,4.88,0,46.7,10,433,433,3.3,0,0,,,,800,,0,,,,0,,,,,,3.33,0,6.67,,,
"Skinnygirl, Fat-Free, Sugar-Free Poppyseed Salad Dressing, 8 fl oz",44448083,74683005928,30,ml,12 fl oz,2.38,0,20,0,200,200,0,0,0.33,,,33,383,,,,,,,,,,,,0,0,3.33,,,0
"Ken's Steak House Chunky Blue Cheese Salad Dressing, 16 fl. oz.",10307553,41335001256,30,g,24 fl oz/1.5 PT/710 mL,3.28,0,15,10,200,200,0,0,0,,,,1030,,0,,,,0,,,,,,10,0,1.67,,,
"Western Sweet and Smooth French Fat Free Salad Dressing, 15 fl oz",152037501,41321301155,30,ml,,2.8,0.2,0.27,32.1,132,132,2.2,5,0.58,3,0,84,853,0.1,75,0.02,0,,0,,0.112,0.1,0,4,16.4,,0.037,0,0,
"Wish-Bone Italian Salad Dressing, 24 fl oz",43596580,41321006609,30,ml,16 fl oz/473 mL,3.48,0,0,10,50,50,0,0,0,,,,1170,,0,,,,8,,,,,,6.67,0,0,,,
"Ken's Steak House Lite Northern Italian Salad Dressing, 16 fl. oz.",10307552,41335000983,30,g,24 fl oz/1.5 PT/710 mL,3.28,0,15,3.33,150,150,0,67,0,,,,867,,333,,,,0,,,,,,3.33,0,3.33,,,
"BRIANNAS Home Style Blush Wine Vinaigrette Salad Dressings, 12 fl oz",10447942,27271117282,29,g,12 fl oz/355 mL,3.48,0,24.1,37.9,345,345,0,0,0,,,0,1070,,,,0,,,,,,,,31,0,0,,,31
"Olive Garden Signature Italian Dressing, 24 fl. oz.",46330172,70200838192,30,g,5.1 oz/145 g,5.68,2.08,27.1,6.25,271,271,0,0,0,,,0,1750,,,,0,,,,,,,,6.25,0,4.17,,,6.2
"Oscar Mayer Real Bacon Bits Value Pack, 4.5 oz Bag, 1-1.5 cups",14869675,44700031407,7,g,,3.9,11,29.1,2.45,316,316,0,12,1.36,14,109,168,1180,2.03,0,,32,,0,,2.42,,0,,1.4,,12.8,0.17,1.43,
"Vlasic Wholes Original Dill Pickles, Kosher Dill Pickles, 80 Oz Jar",10308971,54100460004,28,g,,6.24,0.48,0.43,1.99,,,1,54,0.23,7.1,16,112,808,0.11,,0.12,,,2.1,,0.109,16.8,,,,,,0.034,,
"Mt. Olive Kosher Petite Dill Pickles, 46 fl oz Jar",10290712,9300002189,28,g,4.8 fl oz,5.96,0,0,3.57,0,0,,,,,,,929,,,,,,,,,,,,,,,,,
"Great Value Sliced Salad Olives with Minced Pimento, 10 oz Jar",10315440,78742369754,16,g,10 OZ/283 g,2.44,0,13.3,0,133,133,0,133,,,,,1670,,,,,,,,,,,,0,0,3.33,,,
Vlasic Stackers Bread & Butter Pickles 24 Fl Oz Jar,10308968,54100123794,28,g,,3.47,0.58,0.41,21.2,,,1,61,0.25,7,18,100,457,0.12,764,0.36,0,,0.7,,0.115,47.1,0,3.1,18.3,0,0.067,0.024,0,
"Mt. Olive Kosher Dill Pickle Spears with Sea Salt, 24 fl oz Jar",24093546,9300006507,28,g,4.8 fl oz,2.34,0,0,3.57,0,0,,,,,,,929,,,,,,,,,,,,,,,,,
"Great Value Hot Sliced Jalapeo Peppers, 12 Oz",10416458,605388186850,30,g,12 fl oz,1.97,0,0,7.69,38,38,0,0,0,,,238,1770,,,,,,,,,,,,3.85,0,0,,,0
"Mt. Olive Hamburger Dill Pickle Chips, 46 fl oz",10290685,9300000680,28,g,4.8 fl oz,3.73,0,0,3.57,0,0,,,,,,,929,,,,,,,,,,,,,,,,,
"Famous Dave's Sweet 'N Spicy Pickle Chips, 24 fl oz Jar",20850662,780993787798,28,g,24 fl oz,3.64,0,0,3.57,14,14,0,0,0,,,,929,,,,,,0,,,,,,0,0,0,,,
"Wickles Original Pickles, 16 fl oz",10324850,635617000015,28,g,16 fl oz/1 PT/473 mL,3.97,0,0,28.6,107,107,,,,,,,536,,,,,,,,,,,,25,,,,,
"La Costena Pickled Jalapeno Slices, 15.5 Oz Jar",10309324,76397105116,32,g,11.28 oz/320 g,1.73,0,13.3,16.7,200,200,0,0,2.4,,,,700,,0,,,,0,,,,,,6.67,0,3.33,,,
"La Costena Pickled Serrano Peppers, Green, 12 Oz",10309316,76397003122,30,g,28.2 oz/800 g,1.48,0,0,6.67,50,50,3.3,67,1.2,,,,1800,,,,,,,,,,,,3.33,,,,,
Early California Sliced California Ripe Olives 3.8 oz. Can,38803262,705814728347,16,g,108 g/3.8 oz,2.34,0,15.6,6.25,156,156,0,0,0,,,,781,,0,,,,0,,,,,,0,0,0,,,
"Talk O' Texas Mild Okra Pickles, 16 fl oz",10320789,70573666668,28,g,16 fl oz/473 mL,3.98,0,0,3.57,18,18,3.6,71,0,,,,1250,,357,,,,12.9,,,,,,0,,0,,,
"Vlasic Baby Sweet Whole Pickles, Sweet Pickles, 24 Oz Jar",10321597,54100014306,28,g,,4.54,0.58,0.41,21.2,91,91,1,61,0.25,7,18,100,457,0.12,,0.36,,,0.7,,0.115,47.1,0,3.1,18.3,,0.067,0.024,0,
"Vlasic Kosher Sweet Pickle Relish, Sweet Relish, 10 Oz",10308960,54100018700,15,g,,1.64,0.37,0.47,35.1,,,1.1,3,0.87,5,14,25,811,0.14,1220,0.58,0,,1,,0.233,83.8,0,4.9,29.1,0,0.054,0.015,0,
"Early California Pimiento Stuffed Manzanilla Olives, 5.75 Oz",15570986,705814721126,14,g,,2.27,1.15,12.9,4.96,130,130,4,121,0.31,12.4,7,43,1620,0.09,,3.78,,,0,,0.103,16.6,,1.6,,0,2.3,0,,
"Famous Dave's Sweet 'N Spicy Pickle Spears, 24 fl oz Jar",20850661,780993613080,28,g,24 fl oz/710 mL,3.64,0,0,3.57,18,18,0,0,0,,,0,1180,,,,0,,,,,,,,0,0,0,,,
"La Costena Green Pickled Jalapeno Peppers, 26 Oz",10309302,76397001289,30,g,7 oz/200 g,1.58,0,0,6.67,33,33,,67,2.4,,,233,1600,,,,,,,,,,,,,,,,,
Early California Pimiento Stuffed Manzanilla Olives 21 oz. Jar,10324361,705814721287,14,g,,6.44,1.15,12.9,4.96,130,130,4,121,0.31,12.4,7,43,1620,0.09,,3.78,,,0,,0.103,16.6,,1.6,,0,2.3,0,,
"Great Value Stuffed Queen Olives with Minced Pimento, 10 oz Jar",10315441,78742369761,14,g,10 OZ/283 g,3.64,0,12.5,6.25,156,156,0,,,,,,1620,,,,,,,,,,,,0,0,3.12,,,
"Great Value Stuffed Jalapeno Green Olives, 7oz Jar",744729942,78742366685,13,g,,2.98,1.15,12.9,4.96,130,130,4,121,0.31,12.4,7,43,1620,0.09,,3.78,,,0,,0.103,16.6,,1.6,,0,2.3,0,,
"Vlasic Zesty Dill Pickles, Dill Pickle Spears, 24 Oz Jar",10308903,54100001603,28,g,24 fl oz/710 mL,3.47,0,0,3.57,0,0,0,0,0,,,0,1000,,,,0,,,,,,,,0,0,0,,,
"Great Value Stuffed Garlic Green Olives, 7oz Jar",678594193,78742347172,13,g,,3.34,1.15,12.9,4.96,130,130,4,121,0.31,12.4,7,43,1620,0.09,,3.78,,,0,,0.103,16.6,,1.6,,0,2.3,0,,
"Great Value Chopped Black Olives, 4.25 oz",10315446,78742369815,15,g,4.25 oz/120 g,1.97,0,16.7,6.67,167,167,,,,,,,767,,,,,,,,,,,,,0,0,,,
"Great Value Pitted Kalamata Greek Olives, 6.35oz Jar",871158621,78742366708,15,IU,9.5 oz/270 g,3.34,0,30,0,267,267,0,29,3.33,,,69,1330,,,,267,,,,,,,,0,0,0,,,
"Musco Family Olive Co. Early California Ripe Olives, Sliced, 6.5 Oz",38587659,705814728361,16,g,3.25 oz/92 g,3.14,0,13.3,6.67,167,167,,,,,,,633,,,,,,,,,,,,,0,0,,,
"Vlasic Kosher Dill Pickles, Dill Pickle Spears, 80 Oz Jar",10308972,54100462008,28,g,24 fl oz/710 mL,6.24,0,0,3.57,0,0,,,,,,,1000,,,,,,,,,,,,,,,,,
"Pearls Black Pitted Large California Ripe Olives, 4 Pack, 1.2 oz. Cup",38587552,72999803030,15,g,3 lbs/1.36 kg,4.17,0,16.7,6.67,167,167,,,,,,,767,,,,,,,,,,,,,0,0,,,
"A&W Zero Sugar Root Beer Soda, 12 fl oz cans, 12 pack",17619868,78000053166,,,355 MLT,5.38,0,0,0,0,0,0,0,0,,,0,0,,,,,,0,,,,,,0,0,0,,,0
"Hillshire Farm Sliced Black Forest Ham Deli Lunch Meat, 9 oz",26832120,44500329537,56,g,8 oz/226 g,4.5,18.4,3.06,2.04,102,102,0,41,0.73,,,367,1020,,0,,,,0,,,,,,2.04,0,1.02,,,
"Milo's Famous Sweet Tea, 100% Natural, 128 fluid ounces",21804014,91475041896,236,ml,59 fl oz/1.8 Quart/1.74 L,3.48,0,0,8.06,32,32,,,,,,,6,,,,,,,,,,,,7.26,,,,,
"Freshness Guaranteed Boneless Skinless Chicken Breasts Family Pack, 25g Protein, 4.7 - 6.25 lb Tray",27935840,205496000002,,,,15.18,22.5,2.62,0,120,120,0,5,0.37,28,213,334,45,0.68,30,0.56,1,,0,,9.6,0,0,82.1,0,0.007,0.563,0.811,0.21,
"Great Value Grated Parmesan Cheese, 8 oz",10315402,78742353227,5,g,,2.98,28.4,27.8,13.9,420,420,0,853,0.49,34,627,180,1800,4.2,974,0.53,21,,0,,0.08,1.7,0,14.1,0.07,0.876,15.4,0.081,1.4,
"Frito-Lay Flavor Mix Variety Snack Pack, 18 Count",556798000,28400693356,,,,9.88,8.06,12.1,76.6,444,444,4,0,0.81,,,806,565,,,,0,,,,,,,,8.06,0,0,,,4
"Great Value Chunk Light Tuna in Water, 5 oz",11965048,78742082752,56,g,5 oz/142 g,0.96,19.6,0.89,0,89,89,0,0,0.64,,,134,321,,,,,,0,,,,,,0,0,0,,,
"Stouffer's Salisbury Steak Individual Frozen Meal, 9.6 oz (Frozen)",10318304,13800100702,272,g,,3.48,6.82,8.4,10.9,146,146,1.2,15,0.84,15,72,179,268,1.5,,0.08,,,5.3,,1.58,4,0,34.5,1.35,,3.88,0.164,0.6,
"Great Value Black Beans, 15 oz Can",10534038,78742075761,130,g,,0.82,7.37,0.39,21,114,114,4.9,53,1.57,51,136,351,370,0.65,1,0.79,0,,1.3,,0.461,3,0,29.5,1.41,0,0.12,0.106,0,
"Great Value Fully Cooked Original Pork Sausage Patties, Family Size, 35.6 oz (Frozen)",24360492,78742030623,50,g,,9.92,15.1,41.7,0.62,,,0,17,0.95,15,193,225,990,1.59,75,0.88,41,,0,,4.33,2.9,0,52,0.62,0.209,13.6,0.137,0.76,
"Sargento Sliced Sharp Natural Cheddar Cheese, 11 slices",10291566,46100001134,21,g,,3.18,24.2,33.8,2.13,,,0,711,0.16,27,460,76,644,3.74,994,0.78,41,,0,,0.039,2.4,0,16.5,0.27,1.18,19.4,0.075,0.88,
"Sara Lee Artesano Original Artisan Bread, 20 Oz Loaf of White Bread",46762679,72945612419,38,g,30 oz/850 g,3.46,4.25,4.25,51,255,255,2.8,142,1.53,,,,794,,0,,,,0,,,,,,7.09,0,0.57,,,
"Thomas' Blueberry Bagels, 6 Count, 20 oz Bag",10535150,48121255046,95,g,,4.18,9.47,4.21,52.6,274,274,2.1,95,3.16,,,113,411,,,,,,,,3.79,,94,,5.26,0,0.53,,,5.3
"Mission Gluten-free Yellow Corn Tortillas, 30 Count",14140865,73731063002,,,,2.48,3.51,2.63,43.9,211,211,3.5,35,1.05,,,175,53,,,,,,,,,,,,0,0,0,,,0
"HOSTESS Frosted Mini DONETTES Bag, Chocolate Mini Donuts - 10.75 oz",27047497,888109150020,48,g,9.63 oz/273 g,2.48,1.82,10.9,65.4,345,345,7.3,0,0.91,,,0,382,,,,,,,,,,,,40,0,5.45,,,40
"Great Value Burrito Flour Tortillas, 20 oz, 8 Count",339860540,78742294742,70,g,21.16 oz/1.32 lbs/600 g,1.98,8.33,12.5,50,333,333,4.2,42,0,,,0,625,,,,0,,,,,,,,41.7,0,6.25,,,
"Mission Super Soft Fajita Flour Tortillas, 20 Count",14123550,73731008300,32,g,,3.48,8.7,6,49.6,,,,191,1.99,,,,898,,,,,,,,,,,,,,0.695,,,
"Great Value Pre-Sliced Cinnamon Raisin Bread, 16 oz",23591317,78742018386,28,g,16 oz/1 lbs/453 g,2.28,7.14,3.57,60.7,286,286,3.6,71,3.21,,,286,393,,,,57,,,,,,,,21.4,0,0,,,7.1
"Marketside Chocolate Mousse, 5.75 oz",576904375,681131277914,81,g,,2.44,4.38,15.2,16,211,211,0.6,103,0.54,21,122,154,35,0.66,,0.72,,,0.2,,0.152,1.5,0,73,15.1,,8.72,0.067,0.37,
"a2 Milk, Ultra-Pasteurized Whole Milk, 59 fl oz.",757788854,813267020007,240,ml,118 OZ/3.48 L,4.28,3.33,3.75,5,67,67,0,117,0,,,133,50,,,,0,,,,,,,,5,0,2.08,,,
"Great Value Organic Skim Fat Free Milk, Half Gallon, 64 fl oz",10315796,78742020495,240,ml,,3.98,3.43,0.08,4.92,34,34,0,132,0,12,107,167,41,0.45,,0,,,0,,0.118,0,0,18.2,5.05,,0.049,0.058,0.58,
"Great Value Original Soymilk, 0.5 gal",19500254,78742093871,240,ml,,2.44,2.92,1.46,3.33,38,38,0.8,125,0.45,,,108,50,,208,,50,,0,,,,,,2.5,0,0.21,,1.25,
"Lactaid Whole Milk, 64 oz",10801613,41383090363,240,ml,,4.48,3.27,3.2,4.63,61,61,0,123,0,12,101,150,38,0.42,,0.05,,,0,,0.105,0.3,0,17.8,4.81,,1.86,0.061,0.54,
"Horizon Organic Nonfat High Vitamin D Milk, Half Gallon",10309699,742365264054,240,ml,,4.88,7.55,0.2,11.4,,,0,290,0.29,27,195,332,115,0.9,394,0,79,,1.2,,0.174,0,0,25.2,11.4,,0.121,0.055,0.24,
"Lactaid 2% Reduced Fat Milk, 64 oz",10801608,41383090103,240,ml,,4.48,3.36,1.9,4.9,50,50,0,126,0,12,103,159,39,0.43,,0.03,,,0.2,,0.112,0.2,0,18.2,4.89,,1.11,0.061,0.55,
"Great Value Lactose Free Lowfat Milk, Half Gallon",46491770,78742036410,,,,3.38,3.27,3.2,4.63,61,61,0,123,0,12,101,150,38,0.42,,0.05,,,0,,0.105,0.3,0,17.8,4.81,,1.86,0.061,0.54,
"Nestle Carnation Lowfat 2% Evaporated Milk, Vitamins A and D Added, 12 fl oz",10804669,50000159918,30,ml,,1.72,6.67,2,15.7,,,0,267,0.19,24,203,303,100,0.77,192,0.18,160,,16,,0.194,0.2,0,16.6,6.67,0,1.2,0.05,0.16,
"Great Value Instant Nonfat Dry Milk, 64 oz",10415475,78742352190,23,g,,19.67,35.1,0.72,52.2,358,358,0,1230,0.31,117,985,1700,549,4.41,2360,0.01,440,,5.6,,0.891,0,0,168,52.2,,0.467,0.345,3.99,
"Ripple Dairy Free Plant Based Kids Milk with DHA, 48 fl oz",930162172,810029770170,240,ml,48 fl oz,4.78,3.33,3.33,3.33,58,58,0.8,190,0.42,10,211,227,52,,,,,,,,,,,23,2.08,0,0.42,,0.46,2.1
"Nestle Carnation Evaporated Milk, Vitamin D Added, 17 fl oz",468432372,50000958955,30,ml,17 fl oz,2.92,6.67,6.67,10,133,133,,233,0,,,333,100,,,,,,,,,,,,10,0,5,,,
"Great Value Instant Nonfat Dry Milk, 9.6 oz",55081618,78742135410,23,g,,3.43,35.1,0.72,52.2,358,358,0,1230,0.31,117,985,1700,549,4.41,2360,0.01,440,,5.6,,0.891,0,0,168,52.2,,0.467,0.345,3.99,
"Lactaid Fat Free Milk, 96 oz",17056808,41383090707,240,ml,,6.38,3.43,0.08,4.92,34,34,0,132,0,12,107,167,41,0.45,,0,,,0,,0.118,0,0,18.2,5.05,,0.049,0.058,0.58,
"Nestle La Lechera Sweetened Condensed Milk, 11.8 oz",45791842,28000706111,30,ml,14 oz/397 g,3.68,10,0,86.7,383,383,,333,,,,,150,,,,,,,,,,,,86.7,0,0,,,
"Horizon Organic 1% Lowfat UHT Chocolate Milk, 8 Oz., 12 Count",35506192,742365002700,236,ml,8 fl oz,13.98,3.39,1.06,5.51,47,47,0,127,0,,,178,55,,,,,,,,,,,,5.08,0,0.64,,,0
"Great Value Organic Original Soy Milk, Half Gallon, 64 fl oz",10315731,78742204956,240,ml,,2.44,2.92,1.46,3.33,38,38,0.8,125,0.45,,,108,50,,208,,50,,0,,,,,,2.5,0,0.21,,1.25,
"Nestle Carnation Instant Non fat Dry Milk, 9.625 oz",978118310,50000605644,23,g,9.6 oz/272 g,4.58,34.8,0,52.2,348,348,0,1220,0,,,1700,543,,27100,,696,,4.3,,,,,,52.2,0,0,,,
"Horizon Organic 2% Reduced Fat Grassfed Milk, Half Gallon",911943820,742365007088,240,ml,0.5 GAL/1.89 L,5.98,3.33,2.08,5.42,54,54,0,133,0,,100,175,56,,2500,,42,,,,,,,,5,0,1.25,,0.54,
"Horizon Organic 1% Lowfat UHT Milk, 8 Oz., 12 Count",47094270,742365004346,236,ml,8 fl oz,13.98,3.39,1.06,5.51,47,47,0,127,0,,,178,55,,,,,,,,,,,,5.08,0,0.64,,,0
"Horizon Organic Whole Lactose-Free Milk, Half Gallon",53986353,742365005398,240,ml,,5.12,3.27,3.2,4.63,61,61,0,123,0,12,101,150,38,0.42,,0.05,,,0,,0.105,0.3,0,17.8,4.81,,1.86,0.061,0.54,
"Nestle Nido Fortificada Powdered Drink Mix, Dry Whole Milk Powder, 56.4 oz",14869811,28000823177,30,g,28.1 oz/1.76 lbs/800 g,19.98,23.3,30,36.7,533,533,0,1000,18,,,,350,10,3330,,333,,40,,,,,,36.7,0,16.7,,,
"Jelly Belly Jelly Beans Candy, Extreme Sports Beans, 3 Assorted Flavors, 1 oz",124560264,71567994729,,,,1.48,0,0,91.1,356,356,,,,,,,67,,,,,,,,,,,,68.9,,,,,
"Feastables Karl Gummy Candy Sour Green Apple, 1.8 oz (50g), 1 Bag",1475199539,850027880402,,,3.52 oz/100 g,2.54,3.03,0,81.8,333,333,,,,,,,212,,,,,,,,,,,,54.6,,,,,54.5
"Jelly Belly Jelly Beans Candy, Extreme Sport Beans, Cherry, 1 oz",17324996,71567988629,,,,1.48,0,0,91.1,356,356,,,,,,,67,,,,,,,,,,,,68.9,,,,,
Smart Sweets Novelty Shape Berry Fish Bag 3.5 oz,698328569,669809201201,,,,5.57,10.2,17.7,65.7,463,463,3.1,83,4.58,25,167,224,970,1.09,,3.68,,,,,6.41,27.7,,,1.18,0.059,2.06,0.085,,
"Hi-Chew, Original Mix, Stand Up Pouch, 12.7 Oz.",917819467,851681008379,31,g,1.76 oz/50 g,6.18,2,9,82,420,420,0,0,0,,,,0,,0,,,,0,,,,,,62,0,9,,,
"Feastables Karl Gummy Candy Sour Green Apple, 3.5 oz (100g), 1 Bag",1136757538,850027880389,,,3.52 oz/100 g,4.56,3.03,0,81.8,333,333,,,,,,,212,,,,,,,,,,,,54.6,,,,,54.5
"Feastables Karl Gummy Candy Sour Blue Raspberry, 1.8 oz, 1 Bag",2928484541,850027880617,,,1.74 oz/49.3 g,2.97,0,0,100,389,389,,,,,,,0,,,,,,,,,,,,100,,,,,100
"Marzetti Old Fashioned Caramel Apple Dip, 10.8 oz, 6 Pack",10308635,70200520295,57,g,16 oz/454 g,4.28,2.78,11.1,61.1,361,361,2.8,0,0,,,0,194,,,,0,,,,,,,,47.2,0,5.56,,,47.2
Pink Lemonade Sour Strips,630869996,860001800562,32,g,,3.12,0.22,0.69,48.9,,,0.3,8,0.08,7,7,76,4,0.03,0,0.07,,,14.1,,0.12,0.1,0,2,46.5,0,0.026,0.015,0,
"Quest Nutrition Protein Candy Bites, Gluten-Free, Low Carb, Gooey Caramel, 8 Count",542402201,888849011643,21,g,,8.88,0.17,0,0.73,27,27,0,4,0,4,8,17,3,0.01,,0,,,0,,0,0,0,0,0,,0,0,0,
Skittles Sour Gummies Chewy Candy - 5.8 oz Bag,168000147,22000289735,28,g,12.0 oz,2.18,3.57,0,82.1,321,321,,,,,,,0,,,,,,,,,,,,64.3,,,,,64.3
"Great Value Finely Shredded Sharp Cheddar Cheese, 16 oz",10452477,78742014838,28,g,16 oz/1 lbs/453 g,3.98,21.4,32.1,7.14,393,393,0,689,0,,,71,643,,,,29,,,,,,,,0,0,17.9,,,
"Albanese World's Best 12 Flavor Gummi Bears, Halloween Candy, Family Share 36 oz",193988183,634418523600,32,g,16 oz/453 g,9.54,,,,,,,,,,,,,,,,,,,,,,,,,0,,,,
"Spring Valley Vitamin D3 Vegetarian Jelly Beans, 50 Mcg, 2000 IU, 60 Count",1845153371,194346065127,,,ONE QUART/946 mL,9.88,3.33,3.33,5,62,62,0,125,0.04,,,167,52,,,,42,,,,,,,,5,0,2.08,,,
"Mars Mixed Skittles, Starburst & Life Savers Gummy Candy Variety Pack - 80 Ct Bag",26557648,22000117021,,,32.82 oz,10.84,0,8.62,82.8,,,,,,,,,0,,,,,,,,,,,,55.2,,8.62,,,55.2
"RUSSELL STOVER Sugar Free Assorted Chocolate Caramels, 17.6 oz. bag ( 36 pieces)",522435686,77260069627,,,5.35 oz/152 g,11.32,4.35,23.9,63,478,478,2.2,43,1.57,,,,120,,217,,,,0,,,,,,50,0,15.2,,,
"Kraft America's Classic Unwrapped Candy Caramel Bits for Easy Melting, 11 oz Bag",10308416,70346000026,nan,nan,,2.74,0,12.5,83.3,417,417,0,0,0,,,0,292,,,,0,,,,,,,,75,0,8.33,,,66.7
"Rolo Creamy Caramels in Rich Chocolate Candy, Party Pack 35.6 oz",627343583,34000378586,nan,nan,,13.24,5.08,20.9,68,474,474,0.9,145,0.42,0,71,188,188,0,111,1.1,0,,0.9,,0.04,3.2,0,20.1,63.9,0,14.5,0,0.33,
"Gem Gem Ginger Candy Chewy Ginger Chews Original, 5.0oz, Pack of 1",55501229,857281004001,12,g,5 oz/141.8 g,2.92,0,0,83.3,333,333,0,0,0,,,,0,,0,,,,0,,,,,,83.3,0,0,,,
"OLLY Metabolism Gummy Rings, Apple Cider Vinegar, B12, Chromium, Apple Flavor, 30 Ct",721898445,840160201103,,,,18.88,0.1,0.13,11.3,46,46,0.2,8,0.12,5,7,101,4,0.02,,0.01,,,0.9,,0.073,0,0,1.8,9.62,,0.022,0.018,0,
"OLLY Fiber Gummy Rings Supplement, 5g Prebiotic Fiber,Fructo-oligosaccharides (FOS), Strawberry Watermelon, 60 Ct",1077305882,840160201776,,,,18.88,,,,,,,,,,,,,,,,,,,,,,,,,,,,,
Rainbow Sour Strips,237428492,860001800524,32,g,10 oz/283 g,3.12,2.5,3.75,85,400,400,0,0,0,,,,0,,0,,,,0,,,,,,60,0,2.5,,,
"vitaminwater zero sugar squeezed electrolyte enhanced water, lemonade, 16.9 fl oz, 6 count bottles",24360573,786162003508,,,16.9 OZA,6.58,0,0,0,0,0,0,0,0,,,0,45,,,,,,3,,2.37,,,,0,0,0,0.237,,0
"Bubly Bounce Caffeinated Triple Berry Flavored Sparkling Water, 12 oz, 8 Pack Cans",877364446,12000205682,360,MLT,144 fl oz/4.26 L,3.98,0,0,0,0,0,,,,,,,0,,,,,,,,,,,,0,,,,,
"vitaminwater energy electrolyte enhanced water, tropical citrus drink, 20 fl oz bottle",15567258,786162080004,591,ml,,1.38,0,0,11.3,,,0,8,0,0,0,4,10,0,0,0,0,,25,,0,0,0,0,10.4,0,0,0,0,
"bubly Blueberry Pomegranate Sparkling Water, 12 Fl Oz, 8 Pack Cans",105042532,12000190797,360,MLT,96 OZA,3.98,0,0,5.06,21,21,0,4,0.08,,,59,25,,,,,,4.2,,,,,,4.22,0,0,0.143,0.2,0
"LaCroix Sparkling Water Curate, Cerise Limn (Cherry Lime) - 8pk/12 fl Oz Cans",45007684,73360772023,355,ml,,4.12,,,,,,,,,,,,,,,,,,,,,,,,,,,,,
"Lunchables Ham & American Cheese Cracker Stackers Kids Lunch Snack, 3.2 oz Tray",229669140,44700103210,,,3.2 oz,1.82,12.2,16.7,35.6,333,333,1.1,149,2.22,,,371,811,,,,,,,,,,,,12.2,0,7.78,,,11.1
"bubly Pineapple Sparkling Water, 12 Fl Oz, 8 Pack Cans",138875599,12000182907,,,,3.98,0.43,0.09,8.3,,,0.8,15,0.4,18,4,127,1,0.12,38,0.01,0,,7.7,,0.298,0.3,0,3.8,7.5,0,0.006,0.074,0,
"Lunchables Turkey & American Cheese Cracker Stackers Kids Lunch Snack, 3.2 oz Tray",888875378,44700103203,,,3.2 oz,1.82,12.2,16.7,35.6,333,333,1.1,149,2.22,,,371,811,,,,,,,,,,,,12.2,0,7.78,,,11.1
"Lunchables Pizza with Pepperoni Kids Lunch Snack, 4.3 oz Tray",10452307,44700024102,nan,nan,,1.82,14.4,9.82,28.3,259,259,4.3,155,2.53,41,305,308,474,1.93,,0.81,,,0.2,,2.52,10.8,39,23.2,4.03,,4.22,0.143,1.19,
"Great Value Tonic Water, 33.8 fl oz",10448545,78742089256,240,ml,33.8 fl oz,0.97,0,0,9.17,33,33,,,,,,,8,,,,,,,,,,,,9.17,,,,,
"vitaminwater xxx electrolyte enhanced water, acai blueberry pomegranate, 20 fl oz bottle",16821302,786162150004,600,ml,3 fl oz/88.7 mL,1.58,0,0,0,0,0,,,,,,,0,,,,,,,,,,,,0,,,4,12,
"bubly Sparkling Water, Just Bubly, 12 oz, 8 Pack Cans",470540140,12000181160,nan,nan,1.36 FL OZ/40 mL,3.98,0,0,0,0,0,,,,,,,0,,,,,,,,,,,,0,,,,,0
"bubly Mango Flavored Sparkling Water, 12 oz, 8 Pack Cans",538742129,12000171505,360,ml,,3.98,0.69,0.21,10.4,42,42,1.2,11,0.64,8,16,115,4,0.07,,,,,0.3,,0.26,8.1,,,6.99,0,,0.047,0,
Waterloo Sprklng Wtr Grape 8pk,422471189,819215020501,,,,3.98,0.72,0.16,18.1,69,69,0.9,10,0.36,7,20,191,2,0.07,,0.19,,,3.2,,0.188,14.6,0,5.6,15.5,,0.054,0.086,0,
"bubly Grapefruit Sparkling Water, 12 fl oz, 8 Pack Cans",490194997,12000171475,nan,nan,12 fl oz,3.98,0,0,0.28,0,0,,,,,,23,10,,,,,,,,,,,,,,,,,
"bubly Cherry Flavored Sparkling Water, 12 oz, 8 Pack Cans",899967548,12000171451,360,ml,,3.98,0.69,0.21,10.4,42,42,1.2,11,0.64,8,16,115,4,0.07,,,,,0.3,,0.26,8.1,,,6.99,0,,0.047,0,
"vitaminwater zero sugar rise electrolyte enhanced water, orange, 16.9 fl oz, 6 count bottles",24360575,786162003522,,,16.9 OZA,6.58,0,0,0,0,0,0,0,0,,,0,45,,,,,,3,,2.37,,,,0,0,0,0.237,,0
"Hint Water Variety Pack Pineapple, Watermelon, Blackberry, and Cherry, 16 fl oz, 12 Count",193442066,184739001498,474,ml,5.7 L/474 mL,13.98,0,0,0,0,0,,,,,,,0,,,,,,,,,,,,0,,,,,
"vitaminwater electrolyte enhanced acai-blueberry-pomegranate water, 16.9 fl oz, 6 count bottles",24360574,786162003515,,,240 fl oz/7.1 L,6.58,0,0,0,0,0,,,,,,,0,,338,,,,20.3,,3.38,,,,0,,,0.338,1.02,
"Bubly Bounce Caffeinated Citrus Cherry Flavored Sparkling Water, 12 oz, 8 Pack Cans",266471018,12000194436,360,MLT,2.72 FL OZ/40 mL,3.98,0,0,0,0,0,,,,,,,0,,,,,,,,,,,,0,,,,,
"Gatorlyte Rapid Rehydration Electrolyte Beverage, Strawberry Kiwi, 20 oz Bottle",956362400,52000047912,591,ml,20 fl oz,2.58,0,0,2.37,8,8,,20,,18,,59,83,,,,,,,,,,,,2.03,,,,,2
"Vita Coco Coconut Water, Pineapple, 16.9 fl oz Tetra",17800757,898999030005,240,ml,16.9 fl oz/1.06 PT/500 mL,1.98,0,0,7.5,31,31,,8,,7,8,121,21,,,,,,,,,,,,7.5,,0,,,
"Vita Coco Coconut Water, Pure, 33.8 fl oz Tetra",34789040,898999000503,240,ml,16.9 fl oz/1.06 PT/500 mL,4.38,0,0,7.5,31,31,,8,,7,8,121,21,,,,,,,,,,,,7.5,,0,,,
"Gatorade Fit Electrolyte Beverage, Healthy Real Hydration, Citrus Berry, 16.9 oz Bottle",812576662,52000051551,500,ml,16.9 FL OZ/1.05 PT/500 mL,1.38,0,0,0.6,2,2,,,,,,12,46,,7200,,,,18,,3.2,,,,0.2,,,0.34,,
"BODYARMOR LYTE Sports Drink Strawberry Banana, 16 fl oz",1791121620,810113830223,,,28 floz/828 ml,1,,,,,,,,,,,,,,,,,,,,,,,,,,,,,
"Protein2o 20g Whey Protein Infused Water Plus Electrolytes, Strawberry Watermelon, 16.9 fl oz (Pk of 4)",468912977,858379004859,,,16.9 fl oz,7.78,0,0,0,0,0,,,,,,,0,,,,,,,,,,,,,,,,,
Powerful Chocolate Drink 4pk,418015885,851463005558,,,,12.48,14.2,3.11,69.6,363,363,5.7,504,11.7,248,614,362,308,9.96,0,8.28,0,,92.3,,32.6,1.1,615,18.4,30.1,0.01,1.32,2.2,5.6,
"Vita Coco Coconut Water With Pineapple, 1 Lt",39452011,898999006185,240,ml,16.9 fl oz/1.06 PT/500 mL,4.38,0,0,7.5,31,31,,8,,7,8,121,21,,,,,,,,,,,,7.5,,0,,,
"smartwater vapor distilled premium water, 1.5 liter, bottle",15673702,786162507006,360,ml,,2.38,0,0,0,0,0,,,,,,,0,,,,,,,,,,,,,,,,,
"BODYARMOR Sports Drink Fruit Punch, 20 fl oz, 6 Pack",1972970597,810113830018,,,6 fl oz,6.98,0,0,4.52,20,20,,,,,,,8,,,,,,23.7,,,,,,4.52,,,,,0
"BODYARMOR SportWater, 1L , 1 count",415310511,858176002157,237,ml,1.5 LITER/50.7 FLOZ,1.68,0,0,0,0,0,,,,,,,0,,,,,,,,,,,,,,,,,
"BODYARMOR Sports Drink Orange Mango, 20 fl oz, 6 Pack",1811826051,810113830001,,,16 fl oz/473 mL,6.98,0,0,7.61,30,30,,,,14,,148,8,2.22,1060,,,,12.7,,8.46,,,,7.61,,,0.846,2.54,
"Vita Coco Farmers Organic Coconut Water, 33.8 fl oz",746424548,898999000992,240,ml,16.9 fl oz/1.06 PT/500 mL,4.78,0,0,7.5,31,31,,8,,7,8,121,21,,,,,,,,,,,,7.5,,0,,,
"Vita Coco Pressed Coconut Water, Pressed Coconut, 16.9 fl oz Tetra",960525411,898999010144,240,ml,16.9 fl oz/1.06 PT/500 mL,1.98,0,0,7.5,31,31,,8,,7,8,121,21,,,,,,,,,,,,7.5,,0,,,
"BODYARMOR Sports Drink, Tropical Punch, 16 Fl. Oz., 1 count",194046671,858176002171,236.5,ml,12 fl oz,1,0,0,5.92,25,25,,,,15,,149,8,1.63,,,,2,12.7,,6.76,,,,5.92,,,0.718,1.01,5.4
"Vita Coco Pressed Coconut Water, Pressed Coconut, 33.8 fl oz Tetra",135681983,898999011288,240,ml,16.9 fl oz/1.06 PT/500 mL,4.38,0,0,7.5,31,31,,8,,7,8,121,21,,,,,,,,,,,,7.5,,0,,,
"BODYARMOR Sports Drink, Strawberry Banana, 16 Fl. Oz., 1 count",104932455,858176002065,236.5,ml,28 floz/828 ml,1,,,,,,,,,,,,,,,,,,,,,,,,,,,,,
"FIJI Natural Artesian Water, 33.8 Fl Oz (Pack of 6)",16940646,632565000104,,,33.8 fl oz,13.58,0,0,9.17,33,33,,,,,,,8,,,,,,,,,,,,9.17,,,,,
"CORE Hydration Perfectly Balanced Drinking Water, 30.4 fl oz bottles, 6 Count",665293370,819858020029,360,ml,30.4 fl oz,9.28,0,0,0,0,0,,,,,,,0,,,,,,,,,,,,,,,,,
"Great Value Tonic Water, 7.5 fl oz, 6 Pack Cans",657631229,78742356051,222,ml,1332 MLT,3.14,0,0,0,0,0,0,0,0,,,0,0,,,,,,0,,,,,,0,0,0,,,0
